FY 2012,2/18/12,2/9/12,Omaha Refinishing, Council Bluffs,IA,51501,,,"Worker who was overcome by vapors while refinishing a bathtub, died from asphyxiation."
FY 2012,8/4/12,7/31/12,Iowa DNR - Lake Manawa State Park, Council Bluffs,IA,51501,,,"Worker mowing lawn near canal drowned when mower fell into water, pinning worker underneath."
FY 2012,4/28/12,4/24/12,Oxton Transport Inc., Red Oak,IA,51566,,,Driver on top of transport trailer while monitoring levels of liquid fertilizer died after falling to the concrete after suffering a stroke.
FY 2012,2/25/12,2/8/12,Redmond Construction Inc., Bernard,IA,52032,,,Worker died from head injuries after falling 15 feet while doing construction work.
FY 2012,7/14/12,7/9/12,Consumers Cooperative Society, Kalona,IA,52247,,,Worker cleaning out a grain bin was found unresponsive on ground near bin.
FY 2012,5/5/12,5/1/12,A-1 Siding Inc., Marion,IA,52302,,,Worker died after falling 13 feet from a ladder while working on a second story window at a private residence.
FY 2012,9/15/12,9/10/12,Concrete Foundations Inc., Highway X20 and Abbe Hills Road,IA,52314,,,Back-hoe operator killed when vehicle rolled over and pinned him underneath.
FY 2012,5/12/12,5/12/12,Wal-Mart Stores Inc., Fairfield,IA,52556,,,"Worker was leaving store while on break, tripped on an outside curb and sustained head injuries."
FY 2012,7/21/12,7/16/12,Aluminum Co. of America Bettendorf,,IA,52722,,,Worker performing maintenance on a machine used to cut steel was struck and killed by an overhead carriage.
FY 2012,1/21/12,1/17/12,Estes Express Lines, Davenport,IA,60525,,,Worker was crushed between a dolly and a trailer while attempting to hook two trailers together.
FY 2012,7/7/12,6/27/12,R & R Holsteins, Gooding,ID,83330,,,Worker performing maintenance activities died when he was caught between a feed trailer and a loader.
FY 2012,8/18/12,8/12/12,U.S. Forest Service, Clearwater,ID,83546,,,Worker died when a tree fell on her while she was building a fireline.
FY 2012,1/14/12,12/23/11,Janis Plastics Inc., Antioch,IL,60002,,,Worker was found unresponsive on the floor. Cause of death not yet determined.
FY 2012,5/26/12,5/22/12,Arens Controls Company LLC, Arlington Heights,IL,60004,,,Worker testing energy components for use in hybrid vehicles was killed when an explosion occurred.
FY 2012,7/7/12,6/7/12,Bes Packaging Corp., Elk Grove Village,IL,60007,,,Worker changing a mold on a thermo forming machine was found dead slumped over at the machine.
FY 2012,4/21/12,4/14/12,Knox Swan & Dog LLC, North Barrington,IL,60010,,,"Worker patrolling a residential community pond while inside a kayak was attacked by swans, causing him to fall in the water and drown."
FY 2012,3/10/12,2/28/12,Allied Waste Services of North America LLC, Bensenville,IL,60105,,,Worker loading a dumpster on a truck at a waste services facility was found pinned between the truck and rail system.
FY 2012,12/17/11,12/12/11,Quality Scapes, Streamwood,IL,60107,,,Worker was crushed by an auger inside a salt truck.
FY 2012,12/24/11,12/13/11,K & Y Designs, Schaumburg,IL,60195,,,Worker installing graphic decals died after falling more than 11 feet.
FY 2012,4/7/12,4/4/12,Village of Stickney-Public Works, Stickney,IL,60402,,,Worker riding on the sidestep of a garbage truck died after becoming pinned between the truck and a protruding pipe.
FY 2012,10/8/11,9/30/11,Austin Tyler Construction, Lockport,IL,60441,,,Worker was struck by a truck.
FY 2012,4/21/12,4/9/12,Village of Romeoville- Public Works, Romeoville,IL,60446,,,Worker was struck and killed by a public works vehicle.
FY 2012,12/3/11,12/1/11,Blacha Trucking & Service, Alsip,IL,60453,,,Worker adjusting supports holding up a trailer was killed when his head and torso were caught between two side-by-side trailers.
FY 2012,8/25/12,8/9/12,R&A Construction of Illinois Inc., Willowbrook,IL,60527,,,Worker died from chemical burns after a varnish applied to a floor caught fire.
FY 2012,8/11/12,8/8/12,Ogden Avenue Materials Inc., Chicago,IL,60608,,,Worker died from injuries after falling from an elevated surface.
FY 2012,9/22/12,9/25/12,Jet Import Inc, Chicago,IL,60608,,,Worker died after being struck on the head by a pallet that had fallen from a trailer he was preparing to unload.
FY 2012,9/29/12,9/25/12,Jet Import Inc, Chicago,IL,60608,,,Worker died after being struck on the head by a pallet that had fallen from a trailer he was preparing to unload.
FY 2012,8/4/12,7/30/12,Soudan Metals Company Inc., Chicago,IL,60609,,,Worker processing a coil of rolled steel was struck by the steel roll and pinned between the roll and processing line.
FY 2012,11/19/11,11/18/11,Jan's Roofing Co., Chicago,IL,60618,,,Worker repairing a roof died after falling three stories to the ground.
FY 2012,11/19/11,11/16/11,Heneghan Wrecking Company, Chicago,IL,60619,,,Worker performing building demolition operations was fatally crushed when a section of the wall collapsed on him.
FY 2012,4/14/12,4/9/12,S & J Construction Co. Inc., Chicago,IL,60633,,,Worker was performing steel erection activities and was crushed by a steel beam.
FY 2012,12/10/11,11/24/11,University of Illinois at Chicago - Medical Center, Chicago,IL,60637,,,Worker was shot by a co-worker.
FY 2012,11/19/11,10/22/11,North Star Cable Construction, Chicago,IL,60651,,,Worker servicing a cable line died after falling 15 feet to the concrete pavement.
FY 2012,11/5/11,10/31/11,BJB Properties, Chicago,IL,60657,,,Worker was found unresponsive in a stairwell of the building where he worked.
FY 2012,3/10/12,3/6/12,Epstein Construction Inc., Chicago,IL,60661,,,Construction manager driving his truck on worksite suffered an apparent heart aneurism causing him to lose control of vehicle and strike a piece of construction equipment.
FY 2012,4/7/12,3/25/12,Metropolitan Water Reclamation District, Cicero,IL,60804,,,"Worker making sewer maintenance repairs stepped into a hole, injuring his ankle and back. The worker later died from complications during surgery."
FY 2012,7/14/12,7/7/12,Jose Galtan, Machesney Park,IL,61115,,,Worker loading appliances onto a delivery truck collapsed and died. Cause of death unknown.
FY 2012,8/18/12,8/15/12,Union Pacific Railroad Company, Deer Grove,IL,61243,,,Worker was killed after an 18-wheeler delivering a machine struck the worker.
FY 2012,3/24/12,3/20/12,Valsala Inc., Paw Paw,IL,61353,,,Worker installing a sensor on the highway was struck and killed by a semi-truck.
FY 2012,6/30/12,6/25/12,Illinois Department of Transportation - District 3 Ladd Yard, Springfield,IL,61362,,,"Highway maintenance worker performing mowing operations died after being thrown from the tractor, which landed on top of him."
FY 2012,11/19/11,11/9/11,Black Crow Candle Co., Canton,IL,61520,,,Worker died after falling 9 feet in an elevator shaft to the basement.
FY 2012,4/28/12,4/24/12,Wigand Disposal Company, Princeville,IL,61559,,,Worker collecting garbage died after he was run over by the trash truck.
FY 2012,8/25/12,8/24/12,Komatsu America Corp., Peoria,IL,61639,,,Worker died from injuries sustained while operating a machine used to test hydraulic cylinders.
FY 2012,8/25/12,8/16/12,Cargill Inc., Bloomington,IL,61702,,,Worker died after falling through a first floor hole onto the basement floor.
FY 2012,7/28/12,7/30/12,Illinois State University - Harris Physical Plant, Bloomington,IL,61709,,,University worker was found without a pulse after striking a telephone pole. Autopsy concluded worker died from natural causes.
FY 2012,8/11/12,7/26/12,Quaker Oats, Danville,IL,61832,,,Worker suffered fatal injuries after falling approximately 50 feet from a manlift.
FY 2012,8/11/12,8/4/12,Conagra Foods Inc., Alton,IL,62002,,,Worker died after falling nearly 70 feet while attempting to exit a manlift onto a building's 5th floor.
FY 2012,8/11/12,8/7/12,Kraft Foods Inc., Granite City,IL,62040,,,Employee died after being crushed between a forklift and metal storage racking.
FY 2012,3/31/12,3/28/12,Massman Traylor Alberici, East St. Louis,IL,62202,,,"Employee was working in an aerial lift over a river when a steel pile fell and struck the boom of the lift. The worker, still in the basket, fell into the river and drowned."
FY 2012,5/26/12,5/22/12,Briteway Stripping Services Inc., Fairview Heights,IL,62208,,,Road construction worker was struck and killed by a motorist.
FY 2012,11/19/11,11/18/11,Andrew T. Jacos, Belleville,IL,62220,,,Worker operating a wood chipper was killed after being pulled into the machine.
FY 2012,12/31/11,12/28/11,E Z Roofing, O'Fallon,IL,62269,,,Worker performing roofing activities died when he fell more than two stories to the concrete.
FY 2012,12/31/11,12/24/11,R&M Oil Supply, Smithton,IL,62285,,,Worker was found laying on the ground with his arm in a manhole.
FY 2012,9/1/12,8/11/12,Effingham County Fair - Board of Directors, Altamont,IL,62411,,,Worker was struck and killed by a payloader that was moving concrete barriers.
FY 2012,9/15/12,8/11/12,Effingtham County Fair, Altamont,IL,62411,,,Worker struck and killed by a payloader used to move concrete barriers.
FY 2012,1/21/12,1/20/12,Petco Petroleum Corporation, Saint Elmo,IL,62458,,,Worker was traveling in a backhoe and was crushed after the backhoe toppled into a ditch.
FY 2012,6/30/12,6/22/12,Village of Central City - Public Works Department, Central City,IL,62801,,,Worker was killed when a burning tree limb fell on his head.
FY 2012,6/30/12,6/26/12,Bombardier Recreational Products, Benton,IL,62812,,,Worker test driving a recreational boat was killed when his boat collided with another.
FY 2012,6/30/12,6/26/12,Jason Inc., Benton,IL,62812,,,"Collision of two Sea-Doo boats being demonstrated by manufacturer, one worker fatality."
FY 2012,7/28/12,7/24/12,Bankston Creek Land Trust, Norris City,IL,62869,,,Four workers welding a swab tank were burned when an explosion occurred.
FY 2012,6/2/12,6/1/12,URS Washington Division, Olmsted,IL,62970,,,Worker at a lock and dam construction site was crushed after falling between two barges he was tying together.
FY 2012,1/28/12,1/10/12,S. Daily Deliveries, Harwood Heights,IL,60706,,,Worker died after falling.
FY 2012,10/8/11,10/5/11,Power Source, Zionsville,IN,46077,,,Worker died after falling 22 feet when an open basket door became caught.
FY 2012,4/28/12,4/26/12,PJE Lawn Care, Greenfield,IN,46163,,,"Landscape worker using a tractor with attached chain to remove a tree stump drowned when the chain failed, causing the tractor to roll into a pond, trapping him underwater."
FY 2012,5/5/12,5/2/12,E&B Paving, Indianapolis,IN,46204,,,Worker operating machines that produce asphalt was killed after being wedged between moving conveyor belts.
FY 2012,5/12/12,5/9/12,Milestone Contractors, Indianapolis,IN,46204,,,Worker was walking in a private homeowner's yard and was struck by a motor vehicle.
FY 2012,9/29/12,9/24/12,Indiana Women's Prison ,Indianapolis,IN,46214,,,"Worker was issued a firearm, went outside, and committed suicide."
FY 2012,9/1/12,8/7/12,SSI Services LLC, Indianapolis,IN,46217,,,Worker inside an asbestos pulverizing unit died from injuries after a combustible dust explosions occurred when equipment malfunctioned.
FY 2012,11/12/11,11/1/11,Indianapolis Logistics LLC, Indianapolis,IN,46219,,,Maintenance worker received fatal injuries in electric pallet jack accident.
FY 2012,7/28/12,7/23/12,Herman and Kittie Properties, Indianapolis,IN,46222,,,Worker was struck by Bobcat bucket while loading tree limbs into a dump truck.
FY 2012,9/1/12,8/27/12,Amerifence Inc., Indianapolis,IN,46226,,,Worker for a fence company sweeping the fence production area was electrocuted.
FY 2012,4/21/12,4/16/12,Walsh Construction, Indianapolis,IN,46241,,,"Worker building a barrier wall was crushed when an excavator backed up, pinning the victim between the machine and a wall."
FY 2012,11/19/11,10/29/11,Arcelor Mittal, Burns Harbor,IN,46304,,,Worker died from burns after a steam pipe erupted.
FY 2012,8/18/12,8/14/12,Clean Harbors Catalyst Technologies LLC, Whiting,IN,46394,,,Three workers inside a vessel were hospitalized for burns when a flash fire occurred.
FY 2012,2/4/12,1/30/12,Gary Railroad, Gary,IN,46402,,,Worker was crushed between two railcars.
FY 2012,2/4/12,1/30/12,Manchester Tank, Elkhart,IN,46514,,,Worker pushing a welding cart died from injuries after slipping and falling backwards.
FY 2012,3/24/12,3/23/12,Kachur Tree Service, South Bend,IN,46637,,,Worker was struck on the head and killed by a falling tree limb that was cut by another worker.
FY 2012,7/28/12,7/25/12,Auburn Tree Services, Garrett,IN,46738,,,Worker operating a boom lift to pull a log from a lake died after he was ejected from the lift's basket when the piston on the lift failed.
FY 2012,7/21/12,7/19/12,Living Waters Lutheran Church ,Fort Wayne,IN,46816,,,Worker was struck and killed by a motor vehicle.
FY 2012,8/11/12,8/6/12,Rowlett Tree Service, Henryville,IN,47126,,,Worker was crushed by a tree that was being cut down.
FY 2012,5/5/12,5/4/12,Walsh Construction, Madison,IN,47250,,,Worker was operating an aerial lift and became wedged between the lift basket and beam.
FY 2012,6/2/12,5/30/12,HG Construction, Bryant,IN,47326,,,Worker on a construction site was crushed when a bobcat construction machine rolled over his torso.
FY 2012,5/12/12,5/11/12,Hoosier A1 Sanitary Sewer Services, New Castle,IN,47362,,,Worker was reeling in a high pressure water hose when the nozzle whipped around and the high pressure water cut the worker's carotid artery.
FY 2012,6/23/12,6/17/12,Brown County Guided Trail Guide, Nashville,IN,47448,,,Worker leading a guided horseback trail ride was struck and killed by a falling tree.
FY 2012,8/4/12,7/30/12,Hillcrest Supply Inc., Montgomery,IN,47558,,,Worker at feed mill loading a feeding truck fell while standing on a 9-inch beam.
FY 2012,8/11/12,2/15/12,Otwell Mercantile, Otwell,IN,47564,,,Worker died from asphyxiation while performing maintenance on a tractor inside a closed garage.
FY 2012,11/19/11,11/12/11,Danco Construction, Evansville,IN,47715,,,Worker died after falling six feet from a scissor lift.
FY 2012,10/8/11,8/12/11,Nicholas Cable Communications, Terre Haute,IN,47801,,,Worker discovered unconscious while using a trencher to install underground TV cable.
FY 2012,11/5/11,11/2/11,Ivy Tech Community College, Lafayette,IN,47903,,,Worker fell while climbing tower.
FY 2012,5/5/12,3/28/12,Commercial Trade Source, Lafayette,IN,47906,,,Worker died after falling five feet from a ladder while installing metal cable above a drop ceiling.
FY 2012,4/14/12,4/11/12,Purdy Concrete Inc., Lafayette,IN,47909,,,"Worker inside a swimming pool pit preparing to fill it with concrete was killed when the cement truck tipped over, and fell on him."
FY 2012,6/2/12,5/30/12,Lowe's Construction, Crawfordsville,IN,47933,,,Worker on a grain bin roof removing a metal sheet was killed after being struck by a crane and falling 35 feet.
FY 2012,6/30/12,6/27/12,Seven Hills Dairy LLC, Goodland,IN,47948,,,Worker at a dairy farm was crushed by a front loader bucket.
FY 2012,11/5/11,10/29/11,Kansas Grain Inspection Services, Atchison,KS,66002,,,Two workers were killed while performing grain inspection services at a grain elevator when an explosion occurred.
FY 2012,2/11/12,2/3/12,Defenbaugh Industries Inc., Shawnee,KS,66203,,,Worker on a trash collection route was run over and killed by the trash truck.
FY 2012,1/21/12,1/20/12,Lamdoil Corporation, Marysville,KS,66508,,,"Worker was lifting a piece of tubing that fell off its cribbing while being hoisted. The tubing rolled, pinning the worker to the concrete floor."
FY 2012,9/15/12,9/11/12,Spirit Aerosystems Inc., Wichita,KS,67210,,,Worker died after falling approximately 12 feet from a work platform to the ground.
FY 2012,7/7/12,6/29/12,Solomon Corporation, Solomon,KS,67480,,,"Worker was crushed by a 9,000-pound electrical transformer."
FY 2012,1/7/12,1/4/12,Leonard Getty, St. John,KS,67576,,,"Worker was operating a skid steer loader and slipped out of the loader, crushing the left side of his chest."
FY 2012,11/26/11,11/20/11,ESE Alcohol Inc., Leoti,KS,67861,,,Worker walking on a catwalk that connects to a fermentation tank died when he fell inside the tank.
FY 2012,4/14/12,4/10/12,Harlan Global Manufacturing, Kansas City,KS,68115,,,Worker installing an axle underneath a tractor was killed when the axle fell on his head.
FY 2012,9/15/12,8/23/12,Whispering Hills Landscaping Inc., Radcliff,KY,40160,,,Worker mowing a hillside was killed when the mower overturned.
FY 2012,12/17/11,12/6/11,Silver Brook Stables, Louisville,KY,40241,,,Worker died after being kicked by a horse.
FY 2012,9/1/12,8/25/12,Jorge Vargas dba Jorge Vargas Martinez, Louisville,KY,40291,,,Worker using a ladder to install brick board died after falling off the ladder.
FY 2012,1/28/12,1/19/12,Poff Carting Services LLC, East Bernstadt,KY,40729,,,Worker was pinned between a trash compactor and a truck.
FY 2012,6/30/12,6/29/12,Bluegrass Materials Company LLC, Baxter,KY,40806,,,Worker at a construction materials company died when the forklift he was operating overturned.
FY 2012,4/28/12,4/27/12,City of Manchester- Public Works Dept., Manchester,KY,40962,,,Worker was killed when part of a trench wall fell on him.
FY 2012,9/29/12,9/26/12,Russell Toll dba Toll Roofing and Repair ,Maysville,KY,41018,,,Worker installing a tarp on a roof of a hotel stepped on the eave which collapsed resulting in worker falling approximately 26 feet on to parking lot.
FY 2012,3/3/12,3/2/12,Stein Inc., Ashland,KY,41101,,,Worker performing machine maintenance was crushed between a conveyor belt and machine frame after an unexpected start-up.
FY 2012,9/8/12,9/2/12,Smithfield Packing, Grayson,KY,41101,,,Worker electrocuted while rewiring a breaker panel for a smoke generator.
FY 2012,8/11/12,8/10/12,Louisa Water and Sewer District, Louisa,KY,41230,,,Worker operating vehicle died when it rolled down an embankment.
FY 2012,3/17/12,2/24/12,Worldwide Technologies GPA, Franklin,KY,42134,,,Worker in a tool manufacturing facility broke his neck when he was pulled into a machine used to rotate and shape metals.
FY 2012,7/7/12,6/26/12,River Parish Disposal, Metairie,LA,70003,,,Worker making repairs underneath a garbage truck was killed when the truck rolled over him.
FY 2012,5/19/12,5/16/12,Total Marine Services, Harvey,LA,70058,,,Worker drowned while recovering a boat.
FY 2012,2/4/12,1/27/12,Henderson Construction, Kenner,LA,70062,,,Worker picking up trash on building roof died after falling more than 20 feet and hitting a trash dumpster.
FY 2012,5/19/12,5/17/12,Airport Road, New Orleans,LA,70113,,,Worker cutting grating on a ladder died from a 9-foot fall when a piece of the grating fell on him.
FY 2012,5/5/12,4/21/12,BAC #2 Investments LLC, New Orleans,LA,70122,,,Worker pressure washing near a wall was killed when the wall collapsed.
FY 2012,1/7/12,1/4/12,Southern Tire Mart, New Orleans,LA,70123,,,Worker was crushed when the forklift he was operating overturned.
FY 2012,12/24/11,11/22/11,Paramount Pictures, New Orleans,LA,70129,,,Worker died of head injuries when he fell out of a scissor lift that tipped over.
FY 2012,5/5/12,5/3/12,Allison Marine Contractors, Amelia,LA,70340,,,Marine contract worker unhooking a pressure vessel from a crane line was killed when the vessel tipped over and fell on him.
FY 2012,3/31/12,3/29/12,Modern American Recycling Services Inc., Gibson,LA,70356,,,Worker cutting a metal platform at a scrap yard died when a partially cut metal piece fell on him.
FY 2012,6/9/12,6/4/12,Oil States Industries, Houma,LA,70363,,,Worker inside a fabrication shop was killed when a wall collapsed on him
FY 2012,5/5/12,4/30/12,North American Shipbuilding, Larose,LA,70373,,,Worker for a shipuilding company died from a possible heart attack after being found unconscious at the bottom of a stairway.
FY 2012,11/19/11,11/9/11,Con-Fab Inc., Morgan City,LA,70380,,,Maintenance worker trying to remove a hose from a forklift was fatally crushed by the forks when the hydraulic pressure was released.
FY 2012,5/5/12,4/16/12,Marcella Juarez Concrete, Mandeville,LA,70448,,,Construction worker was struck and killed by lightning while pouring a concrete slab.
FY 2012,5/19/12,5/17/12,Breaux's Mini-Mart, Lafayette,LA,70501,,,"Worker cutting meat at a market died from severe bleeding when he blacked out, falling onto a saw."
FY 2012,2/4/12,1/26/12,J.B. Mouton Inc., Lafayette,LA,70506,,,Worker demolishing a storage area was crushed between a fallen ceiling and the wall.
FY 2012,12/24/11,12/14/11,Roofing Louisiana General Contractors, Lafayette,LA,70508,,,Worker installing shingles on a roof died when he fell nearly 20 feet to the ground.
FY 2012,5/5/12,5/3/12,Frank's Casing Crew & Rental Tools, Lafayette,LA,70508,,,Worker at a tool company helping to move iron pipes was crushed when one of the pipes rolled over him.
FY 2012,9/22/12,9/24/12,SITI, Rayne,LA,70578,,,Worker was pouring concrete when he was struck and killed by a vehicle being driven by another employee.
FY 2012,9/29/12,9/24/12,SITI, Rayne,LA,70578,,,Worker was pouring concrete when he was struck and killed by a vehicle being driven by another employee.
FY 2012,10/1/11,9/28/11,R & R Construction, Westlake,LA,70669,,,Worker attempting to attach slings from a metal bar to a crane was electrocuted when he touched an energized bus bar.
FY 2012,11/5/11,11/1/11,Shintech Louisiana, Plaquemine,LA,70710,,,Worker was crushed by a 15-ton crane.
FY 2012,8/25/12,8/23/12,Praxair Inc., Geismar,LA,70734,,,Worker at an industrial gas plant died from carbon monoxide exposure.
FY 2012,5/12/12,5/10/12,Savanna Energy Services, Keatchie,LA,71046,,,"Worker on a drilling rig was killed when his equipment was entangled in a mechanical unit, pulling him off the rig."
FY 2012,9/15/12,9/12/12,River Cities Machine LLC, Bossier City,LA,71111,,,"Worker was killed after his shirt became caught in a lathe he was operating, pulling him into the machine."
FY 2012,1/7/12,1/5/12,Dreher Contracting, Bastrop,LA,71220,,,Worker delivering a load of rocks in a Bob truck was crushed between the bed and cab.
FY 2012,4/21/12,4/5/12,Verallia Glass Containers LLC, Simsboro,LA,71275,,,Worker at a glass container warehouse was struck and killed by a forklift while stacking products.
FY 2012,12/3/11,11/28/11,D & J Construction Co., W. Monroe,LA,71292,,,Worker operating an excavator in a sand pit was killed when the machine became engulfed in wet sand.
FY 2012,1/7/12,1/4/12,The Migues Deloach Company, Ft. Polk,LA,71459,,,Worker lifting materials using a boom lift was electrocuted after the boom contacted a live power line.
FY 2012,7/7/12,6/24/12,Grand Isle Shipyard Inc., Abbeville,LO,70510,,,Worker was struck and killed by a forklift after the forklift's brakes failed.
FY 2012,1/21/12,1/11/12,Dmitry Ivanov, West Springfield,MA,1089,,,Worker fell through floor openings from the second floor to the basement.
FY 2012,7/14/12,7/6/12,Brookside Farms Inc., West Townsend,MA,1474,,,"Worker loading a hay trailer was killed when the trailer rolled backwards, crushing him."
FY 2012,11/12/11,11/7/11,Horn Packaging Corporation, Lancaster,MA,1523,,,Worker died after becoming entangled in the unguarded shaft of a gluing machine.
FY 2012,10/1/11,9/26/11,GreenLeaf's Tree Service, Chelmsford,MA,1824,,,Worker performing tree removal activities died after falling 70 feet while climbing from a crane to the tree.
FY 2012,11/26/11,11/19/11,SEI Aaron's, Lynn,MA,1901,,,Worker was struck and killed by an overhead door.
FY 2012,8/4/12,7/11/12,Far East Construction Inc., Cambridge,MA,2139,,,Worker performing construction activities died after falling from a ladder.
FY 2012,12/31/11,12/16/11,Tribe Mediterranean Foods, Taunton,MA,2780,,,Worker cleaning the pump feeder skid machine was pulled into it and crushed between the machine's two augers.
FY 2012,7/14/12,7/1/12,R.G. Lumber Corp., Jackman,MA,4945,,,A worker moving a logging machine died when the machine struck him.
FY 2012,7/14/12,7/2/12,R.G. Lumber Corp., Jackman,MA,4945,,,A worker moving a logging machine died when the machine struck him.
FY 2012,9/29/12,7/19/12,Terrapin Construction Bowie,,MD,20715,,,Worker was trimming a tree limb from an extended tree belonging to a neighbor and fell off ladder. Worker was hospitalized but succumbed to injuries and died on 8/13/2012.
FY 2012,3/31/12,2/8/12,Serra Stone Corp., Bethesda,MD,20816,,,Worker at a stone products manufacturer who was attempting to enter his work vehicle died when he was pinned against a brick wall after the truck rolled.
FY 2012,4/14/12,4/10/12,Potomac Abatement Inc., Silver Spring,MD,20910,,,Worker for an environmental hazards solutions company died after falling 10 stories from a self-lifting scaffold.
FY 2012,8/25/12,8/14/12,Best Blue Inc., Ellicott City,MD,21043,,,"Worker putting up a pump jack scaffold was electrocuted after contacting a 7,600-volt phase line."
FY 2012,3/31/12,2/13/12,Southern Management Corp., Towson,MD,21204,,,"Worker for a management facility who was operating a car lift died when the carriage came out of the track and flipped over, ejecting the worker down a 20 foot shaft."
FY 2012,9/29/12,9/26/12,Recovery Home Improvement,Baltimore,MD,21222,,,Worker was electrocuted when a 27-foot ladder hoist the worker was moving fell backwards and struck two 7.62 kV overheard distribution lines.
FY 2012,4/7/12,4/3/12,ET&T Corp., Rosedale,MD,21237,,,Worker making repairs underneath a trailer was killed when the trailer fell on him.
FY 2012,8/11/12,7/31/12,Gamboa Construction, Hanover,MD,21240,,,Worker installing anchorage points on a roof died after falling to the concrete.
FY 2012,7/14/12,7/2/12,Oakland Timberjax LLC, Oakland,MD,21550,,,Worker cutting down trees after storm damage died after falling more than 50 feet to the ground.
