FY 2012,11/12/11,11/5/11,American Biltrite, Moorestown,NJ,8057,,,Worker was crushed in a coating machine.
FY 2012,7/28/12,7/10/12,Leonard Chavarria, Pedricktown,NJ,8067,,,Worker was replacing roof shingles and fell from the seond story level.
FY 2012,10/1/11,8/28/11,Princeton First Aid & Rescue, Princeton,NJ,8540,,,"Worker, attempting to rescue a trapped motorist in fast moving water, drowned after being separated from his tether."
FY 2012,1/14/12,12/14/11,Chanel, Piscataway,NJ,8854,,,Worker was caught between a forklift and a storage rack.
FY 2012,7/21/12,7/17/12,7-Eleven Albuquerque,,NM,87106,,,Store worker died from a gun shot wound to the neck during a robbery.
FY 2012,11/5/11,10/10/11,D & H Pump Service, Albuquerque,NM,87113,,,Worker died from injuries sustained when a fuel dispenser fell on him.
FY 2012,4/14/12,4/13/12,Shamrock Foods, Albuquerque,NM,87120,,,Worker at a food processing facility was killed when an elevated docking board used to fill the gap between a trailer and loading dock fell and struck his head.
FY 2012,9/8/12,9/3/12,High Desert Roofing, Farmington,NM,87401,,,Worker died after falling through a roof opening and hitting concrete floor.
FY 2012,8/25/12,8/21/12,Wiggle Tails Oil Field Service Inc., Bloomfield,NM,87413,,,Worker was crushed under the rear wheels of a truck.
FY 2012,7/21/12,7/20/12,Coranado Wrecking and Salvage Santa Fe,,NM,87503,,,Worker was struck and killed by a load of metal beams being stacked onto a trailer.
FY 2012,7/7/12,7/4/12,San Saba Pecan, Las Cruces,NM,88005,,,Worker using a scissor lift died from injuries suffered when the lift toppled over.
FY 2012,12/10/11,12/5/11,Southwest Concrete and Paving, Deming,NM,88030,,,Worker died after he slipped and fell while clearing asphault.
FY 2012,11/19/11,11/12/11,E-Light Electrical Services, Oil Center,NM,88040,,,Solar farm worker died after developing a respiratory ailment (Desert Fever) while working in the field.
FY 2012,7/7/12,6/24/12,Baja Ranch LLC, Lordsburg,NM,88045,,,Worker was run over and killed by a field tractor.
FY 2012,8/4/12,8/3/12,Clovis Sign Service Inc., Clovis,NM,88101,,,Worker installing a billboard was electrocuted when metal from the sign touched a power line.
FY 2012,11/12/11,11/2/11,Western Dairy Transport, Portales,NM,88130,,,Worker was killed when strong winds caused the door of a transport trailer to strike him.
FY 2012,3/24/12,3/20/12,Donner Plumbing and Heating Inc., Portales,NM,88130,,,"Worker for a plumbing and heating company who was unbolting equipment attached to a hoist was killed when the hoist frame collapsed, pinning the worker between the framing."
FY 2012,7/14/12,6/27/12,Plaska Transmission Line Construction LLC, Eunice,NM,88231,,,"One worker died, another injured after suffering electrical burns when the boom truck they were inside touched a power line."
FY 2012,7/7/12,7/4/12,Forrest Tire Company, Hobbs,NM,88240,,,"Worker was changing a truck tire when it exploded, striking and killing worker."
FY 2012,10/1/11,8/25/11,Unknown, Boulder City,NV,89006,,,Worker towing an airplane crashed into a building at an airport.
FY 2012,8/4/12,8/1/12,Roc Equipment, Clark,NV,89015,,,Worker performing work on a drill rig died from exposure to hydraulic fluid after a cylinder cracked from extreme pressure.
FY 2012,12/10/11,12/2/11,Barstow Truck Parts and Equipment Leasing, Indian Springs,NV,89018,,,Worker was killed when caught-in between a tractor backing up and a trailer.
FY 2012,8/11/12,8/9/12,Rocky Mountain Recycling, Las Vegas,NV,89030,,,Worker at a recycling facility was crushed under a forklift after it tipped over.
FY 2012,4/7/12,4/6/12,Rotech Granite Inc., Las Vegas,NV,89109,,,Worker raised a diamond saw table unit above his head to disassemble it from underneath and was crushed when the table top fell on him.
FY 2012,1/7/12,10/27/11,Redcor Drilling, Winnemucca,NV,89446,,,Worker died inside of a water truck after it rolled down an embankment.
FY 2012,9/15/12,9/13/12,Fisher Industries, Mile Post 392,NV,89521,,,Worker making repairs to a tire compactor was crushed between the compactor and a drum roller.
FY 2012,4/7/12,4/3/12,J & E Industries LLC, New York,NY,10001,,,Worker was killed at a construction site when a crane fell on him.
FY 2012,4/21/12,2/10/12,Star Wars Technology Systems Inc., New York,NY,10007,,,Worker installing heat control cabling died after falling off a ladder and hitting his head on the concrete floor.
FY 2012,5/19/12,5/17/12,Bras-Al Construction Corp., New York,NY,10013,,,Worker on a construction site died after falling two stories from a scaffold and landing on a sidewalk shed.
FY 2012,12/24/11,12/14/11,Young & Rubicam, New York,NY,10017,,,Worker was crushed between the passenger elevator car and the shaft wall.
FY 2012,4/21/12,11/17/11,Dragados USA/Judlau, New York,NY,10017,,,Worker using a concrete sprayer during tunnel repairs was struck and killed by falling concrete.
FY 2012,11/12/11,10/13/11,West New York Restoration of CT, New York,NY,10019,,,Worker installing a fall protection safety line died after touching a live wire while on a ladder and falling 92 feet.
FY 2012,11/19/11,10/8/11,Built Rite Contracting Corp., New York,NY,10021,,,Worker was struck and killed by his unoccupied truck as it rolled to the bottom of an incline.
FY 2012,3/31/12,3/22/12,Breeze National Inc., New York,NY,10027,,,Worker for a trash and junk disposal company was killed when part of a two-story building collapsed.
FY 2012,9/8/12,3/28/12,Schindler Elevator Corp., NY,NY,10104,,,Elevator mechanic was electrocuted while working on a panel.
FY 2012,1/7/12,12/27/11,JP Salvage, Staten Island,NY,10309,,,Worker died after he fell from an elevated platform.
FY 2012,2/11/12,1/23/12,BEI Engineering Services, Bronx,NY,10462,,,Worker was killed after the vehicle blocking a work zone was struck by an intermodal container.
FY 2012,11/19/11,11/11/11,Mamaroneck Tn Hwy Dept., Mamaroneck,NY,10543,,,Worker was struck and killed by a local government truck in a recycling yard while performing leaf collection.
FY 2012,5/5/12,4/13/12,Peekskill City Dept. of Public Works, Peekskill,NY,10566,,,Worker for a public works department suffered head trauma after falling from a truck.
FY 2012,9/1/12,8/22/12,Action Roofing & Siding LLC, Rye,NY,10580,,,Worker removing old shingles from a residential roof died after falling from roof
FY 2012,9/8/12,9/5/12,Werkheiser Roofing, Rye,NY,10580,,,Worker died after falling 20 feet from a ladder.
FY 2012,9/22/12,9/22/12,Olmar Salazar, Airmont,NY,10901,,,Employee died after being struck by a tree branch while working on a landscaping site.
FY 2012,9/29/12,9/22/12,Olmar Salazar, Airmont,NY,10901,,,Employee died after being struck by a tree branch while working on a landscaping site.
FY 2012,12/10/11,12/9/11,Haverstraw Transit, Haverstraw,NY,10927,,,Worker died when he fell from a ladder while repairing a garage bay door opener.
FY 2012,6/2/12,5/29/12,Pearl River Home Improvement Inc., Nanuet,NY,10954,,,Worker making repairs to a residential roof died after falling off roof.
FY 2012,12/17/11,12/9/11,Precision Facilities Corporation, West Point,NY,10996,,,"Worker suffered fatal injuries after falling off a ladder, hitting his head on concrete."
FY 2012,8/25/12,8/20/12,Hephalstos Building Supplies Inc., Astoria,NY,11104,,,Worker loading his vehicle with building supplies was struck and killed by a bus.
FY 2012,9/15/12,9/10/12,S&B Masonry Corp., Brooklyn,NY,11205,,,Employee died when a masonry wall collapsed on him.
FY 2012,11/19/11,11/8/11,SP&K Construction, Brooklyn,NY,11235,,,One worker died and three others were hospitalized when multiple floors collapsed in the structure where they were pouring concrete.
FY 2012,9/15/12,9/4/12,NYCDPR Al Oreter Recreation Center, Flushing,NY,11355,,,Worker was fatally stabbed during a verbal altercation with a garbage truck operator.
FY 2012,6/2/12,5/21/12,Rainbow Land Nursery School Inc., Woodside,NY,11377,,,Worker fell from a ladder.
FY 2012,9/15/12,8/27/12,MTA LIRR Hillside Yard Gang 26, Jamaica Queens,NY,11423,,,Worker performing maintenance work electrocuted after contacting an energized rail.
FY 2012,7/28/12,7/23/12,Locust Valley CSD, Locust Valley,NY,11560,,,A school bus driver was killed when a cement mixer collided head-on with the bus.
FY 2012,6/23/12,5/17/12,New York City Parks & Recreation, Far Rockaway,NY,11691,,,Worker for a city parks and recreation department died from overexposure to sealant and dye fumes.
FY 2012,12/3/11,11/26/11,81 Saxon Avenue Corp., Bay Shore,NY,11706,,,Laundry services worker was crushed by a conveyor shuttle.
FY 2012,9/15/12,9/1/12,Zorienzan's Amusements Inc., Brentwood,NY,11717,,,Carnival worker was fatally struck by a ride's spinning bucket.
FY 2012,3/10/12,3/8/12,Nugent's Tree Service Inc., Massapequa,NY,11758,,,Worker died after falling while trimming trees.
FY 2012,5/12/12,12/11/11,DBA Giannini Landscaping, Massapequa,NY,11758,,,Worker performing landscaping services was electrocuted after touching electrical lines.
FY 2012,11/5/11,11/1/11,Avalon Commons, Smithtown,NY,11787,,,Worker pumping sludge out of a sewage treatment tank died after falling into tank.
FY 2012,11/5/11,10/28/11,Intercounty Paving Associates of NY, Hicksville,NY,11801,,,Worker was struck by a motor vehicle.
FY 2012,1/7/12,12/30/11,Burt's Reliable Inc., Southold,NY,11971,,,Worker died from burns after heating a valve with a torch during a fuel transfer operation.
FY 2012,6/2/12,5/25/12,Delsignore Blacktop Paving Inc., East Greenbush,NY,12061,,,Worker lowering a tall light mast used to illuminate large areas was electrocuted when the light fixture touched a power line.
FY 2012,12/3/11,12/1/11,Albany Steel Inc., Menands,NY,12201,,,Worker died after falling 18 feet from a ladder.
FY 2012,1/21/12,1/18/12,Hunter Mountain Ski Bowl, Hunter,NY,12442,,,"Worker slid off the trail and into the woods, striking a tree."
FY 2012,12/3/11,11/26/11,United States Department of Agriculture, South Fallsburg,NY,12779,,,Federal safety inspector died of respiratory system complications.
FY 2012,1/28/12,1/25/12,Maurice DeMars, Queensbury,NY,12804,,,Worker was trapped under a log.
FY 2012,11/26/11,11/20/11,Northern Lights Auto Service, Mattydale,NY,13211,,,Worker was helping a driver whose vehicle was disabled and was struck and killed by a passing tractor trailer.
FY 2012,9/22/12,9/20/12,Ryan's Tree Service, Chaumont,NY,13622,,,Worker died after being crushed by a chipper.
FY 2012,9/29/12,9/20/12,Ryan's Tree Service, Chaumont,NY,13622,,,Worker died after being crushed by a chipper.
FY 2012,12/10/11,12/5/11,Decker Forest Products, Bainbridge,NY,13733,,,Worker was cutting down a tree when he was struck and killed by a nearby falling tree.
FY 2012,2/18/12,2/11/12,Winsor Acres Inc., Harpursville,NY,13787,,,Worker was struck and killed by a skid steer bucket.
FY 2012,6/30/12,6/13/12,Erie County Medical Center, Buffalo,NY,14215,,,Hospital worker was shot and killed.
FY 2012,3/17/12,3/13/12,Eberts Electric Inc., Amherst,NY,14226,,,Worker replacing a device that limits the amount of current in an electrical circuit was electrocuted after touching a live electrical component.
FY 2012,5/26/12,4/16/12,Keuka Lake Vineyards Ltd., Hammondsport,NY,14840,,,Worker at a vineyard was crushed by tractor that rolled over during a spraying operation.
FY 2012,5/5/12,4/30/12,Glavas LLC, Willoughby,OH,,,,Worker performing electrical work died from head injuries when he fell 20 feet from a ladder.
FY 2012,12/10/11,12/5/11,Fazio Mechanical Services, New Albany,OH,43054,,,Worker servicing a refrigeration unit leak collapsed and died.
FY 2012,8/11/12,8/4/12,Tuckerman Home Group, New Albany,OH,43054,,,Worker died after falling approximately 20 ft from a roof.
FY 2012,7/14/12,7/8/12,Owens Coming, Newark,OH,43055,,,Worker for an insulation manufacturer was found dead from possible heat stress.
FY 2012,9/8/12,9/6/12,Select Sires Inc., Plain City,OH,43064,,,Worker was crushed between the gate and post of a pen when letting bulls out to feed.
FY 2012,9/15/12,9/14/12,Worthington Cylinder Corporation, Westerville,OH,43082,,,"Employee was crushed between two 2,500-pound coils."
FY 2012,1/14/12,1/10/12,Toxco, Lancaster,OH,43130,,,Worker changing a tire on earthmoving equipment was crushed between a block of wood and the equipment.
FY 2012,6/9/12,6/4/12,Arcelor Mittal Columbus LLC, Columbus,OH,43207,,,Worker for a steel products manufacturer died after complaining of pain.
FY 2012,10/1/11,9/6/11,Bryan Shirk, Upper Arlington,OH,43221,,,"Worker was trimming trees from a truck-mounted basket lift, and was killed after being thrown from the basket and falling nearly 30 feet to the ground."
FY 2012,3/24/12,3/20/12,Genpak LLC, Columbus,OH,43228,,,Worker at a packing and crating facility who was cleaning a machine used to make rolls of plastic was killed after being pulled into the machine.
FY 2012,9/8/12,9/4/12,Mark F. Taggert Company, Columbus,OH,43229,,,Worker died from fall from a ladder.
FY 2012,9/22/12,9/22/12,Mark F. Taggert Company, Columbus,OH,43229,,,Worker died from fall from a ladder.
FY 2012,9/29/12,9/22/12,Mark F. Taggert Company, Columbus,OH,43229,,,Worker died from fall from a ladder.
FY 2012,2/4/12,1/3/12,Nucentury Textile Services LLC, Toledo,OH,43604,,,Worker killed after shirt was caught in a roller conveyor.
FY 2012,9/15/12,8/1/12,Libbey Glass Inc., Toledo,OH,43697,,,Employee died from fall at work.
FY 2012,12/24/11,12/17/11,Heritage Waste Technologies Industries, East Liverpool,OH,43920,,,"One worker died, another was seriously burned after handling nonferrous metal material."
FY 2012,3/24/12,3/19/12,D & E Tree Service, Scio,OH,43988,,,"Worker trimming trees from inside a truck's elevated bucket was killed when the bucket fell, crushing him between it and the truck's cab."
FY 2012,12/17/11,12/12/11,BJ's Wholesale Club, Avon,OH,44011,,,Worker was found slumped over a guardrail.
FY 2012,9/15/12,9/12/12,Athos Construction, Avon,OH,44011,,,Employee working in temporary work zone was struck and killed by a motor vehicle.
FY 2012,11/5/11,10/28/11,Arberia, Lakewood,OH,44107,,,Worker was killed when he fell 15 feet from a collapsed roof.
FY 2012,5/19/12,5/12/12,Cuyahoga Concrete Company, Cleveland,OH,44115,,,Worker using a pneumatic chisel to clean out the inside of a concrete truck was found dead.
FY 2012,6/30/12,6/26/12,General Motors Corp., Cleveland,OH,4413,,,Worker at a metal processing plant was killed after being caught between machinery.
FY 2012,1/28/12,1/24/12,RALG Demolition LLC, Cleveland,OH,44134,,,A building under demolition collapsed killing two workers.
FY 2012,11/26/11,11/17/11,Reilly Painting and Contracting, Cleveland,OH,44135,,,"Worker cleaning up after repairing a roof, died when he fell off the roof and landed on his head."
FY 2012,1/28/12,1/18/12,Swagelok Company, Solon,OH,44139,,,"Employee was performing assembly work when worker fell to the floor, suffering an apparent seizure."
FY 2012,11/12/11,11/10/11,Kokosing Construction Company, Brecksville,OH,44141,,,Worker setting up a traffic control board was struck and killed by a semi-truck.
FY 2012,7/21/12,4/26/12,Alside Supply Center, Cuyahoga Falls,OH,44223,,,Worker at a residential building supply company died from a possible heart attack.
FY 2012,3/31/12,3/27/12,Lockhart Concrete Company, Kent,OH,44240,,,Worker at a concrete manufacturing facility was crushed between a precast concrete slab and excavator.
FY 2012,5/19/12,5/16/12,Dayton Freight Lines Inc., Kent,OH,44240,,,Worker for a freight line company scanning a bar code with a hand held bar code scanner was crushed by the mast of a lift truck.
FY 2012,2/25/12,2/23/12,Walmart, Streetsbooro,OH,44241,,,Worker unloading a general merchandise truck died from apparent heart attack.
FY 2012,6/30/12,6/25/12,Bob Evans Restaurant, Streetsboro,OH,44241,,,Restaurant worker died from surgical complications after falling and fracturing her right hip.
FY 2012,2/11/12,2/8/12,Better Management Corporation of Ohio Inc., Columbiana,OH,44408,,,Worker struck in the leg by a pipe died after falling and hitting his head.
FY 2012,6/9/12,6/6/12,Tele-Solutions Inc., Salem,OH,44460,,,Worker suffered a fatal fall while installing telecommunications equipment.
FY 2012,6/2/12,5/31/12,Nelson Tree Service Inc., Youngtown,OH,44501,,,Worker clearing trees from power lines died after falling 45 feet.
FY 2012,7/21/12,7/16/12,MKE Producing, Bolivar,OH,44612,,,Two workers died when a gas well they were painting exploded.
FY 2012,3/24/12,3/20/12,Rayson Logging, Dundee,OH,44624,,,Worker performing logging operations was struck and killed by a tree.
FY 2012,1/28/12,1/27/12,Advanced Cylinder Repair Inc., Ashland,OH,44805,,,Worker was struck by a piston that was ejected from a machine.
FY 2012,9/15/12,9/12/12,Grower's Chemical Corporation, Norwalk,OH,44857,,,Farm worker died after being struck in the head by a hooper wagon.
FY 2012,3/3/12,3/2/12,Ohio American Water, Tiffin,OH,44883,,,Worker was struck and killed by a vehicle while operating a water valve.
FY 2012,6/30/12,6/27/12,Hav-Tech Inc., Fairfield,OH,45014,,,Worker installing plywood sheeting on a roof fell from a ladder after suffering an apparent heart attack.
FY 2012,6/2/12,5/25/12,Espinoza Construction, Cincinnati,OH,45237,,,Worker performing roof repairs at a residential site died after falling off the roof.
FY 2012,11/26/11,11/14/11,Wertling and Sons, Burkettsville,OH,45310,,,Worker died from an apparent electrocution after being found in the boiler room with multiple burns.
FY 2012,11/19/11,11/12/11,J R Excavating, Fairborn,OH,45324,,,"Worker replacing a sewer line inside a trench was killed after natural gas contacted an ignition source, causing an explosion and fire."
FY 2012,8/25/12,8/1/12,A.H. Sturgill Roofing Inc., Miamisburg,OH,45342,,,Worker performing roofing activities suffered a heat stroke and later died.
FY 2012,8/4/12,7/27/12,ATW Automation Inc., Dayton,OH,45402,,,Worker operating a core pole assembly machine died after being caught in between two conveyors.
FY 2012,12/24/11,12/20/11,Rumpke of Ohio, Dayton,OH,45402,,,Worker sweeping up pieces of paper was killed when six bales of paper fell on him.
FY 2012,8/11/12,8/6/12,P.H. Glatfelter Paper, Chillicothe,OH,45601,,,Worker operating a bulldozer died when she was runover by the machine while trying to jump from it when it caught fire.
FY 2012,7/14/12,7/12/12,Hearthside Food Solutions LLC, McComb,OH,45858,,,Worker died after experiencing shortness of breath while packaging cookies on a production line.
FY 2012,1/14/12,1/10/12,Minster Machine Company, Minster,OH,45865,,,Worker operating an overhead crane to move a foundry flask died when caught between two flasks.
FY 2012,6/23/12,6/18/12,Universal Roofing & Sheetmetal, Norman,OK,73014,,,Worker died from a 50-foot fall while repairing a roof.
FY 2012,2/25/12,2/20/12,Win-Sons Poleline Construction, Watonga,OK,73040,,,Worker replacing lightning arresters on electrical lines was electrocuted after touching an energized line.
FY 2012,3/24/12,3/20/12,OGE Red Bud Power Plant, Luther,OK,73054,,,Worker tightening bolts on a steam drum died from blunt force trauma and burns when increased pressure caused drum to explode.
FY 2012,9/8/12,9/1/12,OG&E Energy Corp., Mustang,OK,73064,,,Employee for an energy supply company was electrocuted.
FY 2012,5/5/12,4/23/12,Horizon Energy Services LLC, Oklahoma City,OK,73135,,,"Drilling worker was killed when a hydraulic line used to lift machinery broke, pinning him underneath the equipment."
FY 2012,5/5/12,4/21/12,Dan D. Drilling Inc., Capron,OK,73717,,,Worker for a drilling company died when he fell from a derrick platform to the rig floor.
FY 2012,3/3/12,3/1/12,White Hawk Engineering and Design, Kingfisher,OK,73750,,,Worker surveying a wheat field was struck and killed by a train as he crossed a railroad track.
FY 2012,2/4/12,2/3/12,Pistol Drilling LLC, Woodward,OK,73801,,,Worker unloading an A leg of a derrick died after he was struck and pinned under several falling A legs.
FY 2012,10/8/11,9/22/11,Reproduction Services, Stillwater,OK,74075,,,"Worker, on the roof of a barn he was building, died when he fell through a skylight, hitting the floor below."
FY 2012,11/12/11,11/7/11,Horizon Energy Services, Foraker,OK,74652,,,Worker on an oil/gas well drilling rig was struck and killed by a block that fell to the rig floor.
FY 2012,7/14/12,7/10/12,Knife River Corporation - Northwest, Canby,OR,97013,,,Worker placing roadway signs at an intersection was struck and killed by a vehicle.
FY 2012,9/15/12,9/12/12,Farwest Portable Crushing Inc., Gresham,OR,97030,,,Worker operating a construction vehicle was killed when vehicle rolled over and down a hill.
FY 2012,5/26/12,5/20/12,Columbia County Mental Health, St. Helens,OR,97051,,,Worker delivering medications at a mental health facility was attacked and fatally stabbed by a patient.
FY 2012,4/14/12,4/11/12,State of Oregon State Hospital, Salem,OR,97301,,,Worker attempting to restrain a patient collapsed and died from apparent natural causes.
FY 2012,5/12/12,5/9/12,Allen & Gibbons Logging Inc., Canyonville,OR,97417,,,"Worker had just set chokers in a unit of tree length on steep terrain. When the lines came tight, the log swung forward and struck the victim in the chest and head."
FY 2012,6/23/12,6/15/12,Millicoma Logging LLC, Ten Mile,OR,97420,,,Worker was fatally injured when a log being lifted by equipment broke and fell on his chest.
FY 2012,7/28/12,7/23/12,Pacific Coast Contracting Inc., Medford,OR,97501,,,Worker was killed when the forestry van he was riding in was struck by a motor vehicle.
FY 2012,9/1/12,8/22/12,Pendleton A-1 Hospitality LLC, Pendleton,OR,97801,,,Hotel worker found inside hotel room was a victim of homicide.
FY 2012,3/24/12,3/4/12,JM Manufacturing Inc., Umatilla,OR,97882,,,Worker performing maintenance at a pipe fitting manufacturer was killed when a 396-pound plastic pipe fell on him.
FY 2012,1/21/12,1/16/12,Cronimet Corporation, Aliquippa,PA,15001,,,Worker was struck and killed by a powered industrial truck.
FY 2012,9/8/12,9/6/12,Construction Engineering Consultants Inc., Beaver Falls,PA,15010,,,Employee was struck and killed by a dump truck moving in reverse.
FY 2012,9/8/12,9/2/12,GreenTek Roofing, Carnigie,PA,15106,,,Worker died after falling from a roof.
FY 2012,6/30/12,6/28/12,R & B Mechanical Inc., West Mittlin,PA,15122,,,Worker died of a possible heart attack or from being caught between top of aerial lift and the ceiling.
FY 2012,10/8/11,9/30/11,Steve Wolota General Contractor, McKees Rocks,PA,15136,,,Worker performing roofing work died after falling more than 10 feet to the ground.
FY 2012,5/12/12,5/9/12,DLS Tree Services, Edgeworth,PA,15143,,,Worker was electrocuted when the pole saw he used to trim trees touched an overhead power line.
FY 2012,11/12/11,10/28/11,J.J. Tree Service and Landscaping, Monroeville,PA,15146,,,Worker died when he suffered a severe laceration to his leg while cutting tree branches.
FY 2012,5/26/12,5/22/12,American Contracting Enterprises Inc., Pittsburgh,PA,15206,,,Worker performing asbestos removal was electrocuted.
FY 2012,11/19/11,11/15/11,Brookman Iron and Metals, Washington,PA,15301,,,Worker was crushed after part of a bulldozer bucket being cut for scrap collapsed on him.
FY 2012,12/24/11,12/19/11,Allen Enterprises & Recycling, Connellsville,PA,15425,,,"Worker was crushed by two 1,100-lb. bales of recycled paper that collapsed on top of him."
FY 2012,9/15/12,9/7/12,J.R. Resources LP, Ringgold,PA,15570,,,Worker pumping fluid out of a plastic tank died when the tank exploded.
FY 2012,6/9/12,6/6/12,Jay Springer Contracting, Ligonier,PA,15658,,,Worker died after falling off of roof he was repairing.
FY 2012,10/1/11,9/19/11,KG Construction, Saltsburg,PA,15681,,,Worker moving an aluminum materials lift was killed when the lift touched an energized powerline.
FY 2012,4/7/12,4/1/12,Mersen USA St. Mary's PA-Corp., St. Mary's,PA,15857,,,"Worker operating a powered industrial truck died when the raised fork from another truck struck his leg, cutting a main artery."
FY 2012,11/12/11,10/25/11,Yubas Construction, Johnstown,PA,15906,,,Worker died from head and spinal injuries after falling 20 feet from a roof.
FY 2012,7/21/12,7/17/12,Bruce and Merrilees Electric Company, New Castle,PA,16101,,,"Worker transporting a telephone pole died from head trauma when a vehicle hit the pole, causing the pole to strike the worker's head."
FY 2012,11/5/11,11/3/11,WS Packaging Group, Franklin,PA,16323,,,"Worker using a flammable solvent to clean a mixer blade was killed when a piece of equipment ignited the solvent, causing a flash fire."
FY 2012,4/7/12,4/5/12,Patterson UTI, Tionesta,PA,16353,,,Worker connecting pipes at a gas well site was crushed between a beam and pipe.
FY 2012,8/18/12,8/16/12,Osmic Inc., Titusville,PA,16354,,,Worker died after falling 30 feet while removing bolts from a crane rail.
FY 2012,1/7/12,1/4/12,Utilities Forestry Services, Duncansville,PA,16635,,,Worker using a chain saw to cut down trees was struck and killed by falling limbs from another tree.
FY 2012,7/21/12,7/13/12,Baker Logging, Williamsburg,PA,16693,,,Worker cutting lumber was struck and killed by a falling tree.
FY 2012,12/17/11,12/10/11,Highlands Drilling, Wellsboro,PA,16901,,,"Worker walking alongside a forklift was run over and killed when he fell, landing in front of the forklift's rear tire."
FY 2012,6/9/12,6/4/12,Ward Manufacturing Inc., Blossburg,PA,16912,,,"Worker sustained a head injury while working on a SPH 40 core machine, which is used as part of a foundry process to prepare raw materials for forming the end-product."
FY 2012,11/5/11,10/27/11,Walter R Lindenmuth Lumber & Supply, Green Point,PA,17038,,,Worker changing knife blades on a wood chipper was killed when he was caught between the chipper's spout and mounting plate.
