FY 2012,4/14/12,4/10/12,274 East Memorial LLC, Hagerstown,MD,21740,,,Worker on the back of a small vehicle used for hauling trash died from injuries after he was thrown from the vehicle when it made a turn.
FY 2012,7/7/12,7/2/12,Elite Spice Inc., Jessup,MD,21849,,,Worker was crushed in the mast of a forklift.
FY 2012,7/7/12,6/18/12,Cooper Road LLC, Parsonburg,MD,21849,,,Worker died after falling six feet while installing wiring.
FY 2012,10/8/11,9/21/11,Stevens Electric & Pump Service, Kennebunkport,ME,4046,,,Two workers died from overexposure to hydrogen sulfide while inside a sewer tank.
FY 2012,1/21/12,1/16/12,Hawkeye, Scarborough,ME,4074,,,Worker died after falling 50 feet from a utility pole.
FY 2012,1/14/12,1/11/12,Seaway Painting, Detroit,MI,,,,Worker died after falling from the underside of a bridge into a river.
FY 2012,6/2/12,5/20/12,Corrections Corporation of America, Natchez,MI,39120,,,Worker at a correctional facility was killed during a prison riot.
FY 2012,6/30/12,6/14/12,M. G. Dyess Inc., DeKalb,MI,39328,,,Worker was crushed by pipes after the strap holding a load of pipes together broke.
FY 2012,8/25/12,8/21/12,Oakland County Road Commission, Beverly Hills,MI,48025,,,Worker operating a dump truck used for road resurfacing was killed when truck rolled into a ditch.
FY 2012,3/17/12,3/10/12,Survey Solutions Inc., St. Clair Shores,MI,48081,,,Worker inside a roadway work zone was struck and killed by a vehicle.
FY 2012,8/4/12,7/29/12,U.S. Postal Service, Allen Park,MI,48101,,,Worker was found unconscious with a serious head injury.
FY 2012,1/28/12,1/3/12,L & S Plumbing Inc., Ann Arbor,MI,48103,,,Worker fell while drilling a floor joist on a 6-foot step ladder.
FY 2012,12/24/11,12/20/11,Mead Brothers Excavating, Ann Arbor,MI,48104,,,Worker was crushed beneath a hydraulic excavator.
FY 2012,11/19/11,10/24/11,Spartan Steel Coating, Monroe,MI,48162,,,Maintenance worker adjusting a belt wrapper was crushed between the wrapper and machine frame.
FY 2012,1/14/12,1/11/12,U.S. Customs and Border Protection, Trenton,MI,48183,,,Worker committed suicide inside a service vehicle with a service-issued firearm.
FY 2012,12/24/11,11/28/11,Ethical Exteriors, Ann Arbor,MI,48198,,,Worker died after falling nearly 50 feet from a ladder.
FY 2012,7/14/12,6/22/12,Green Mountain Tree Service, Detroit,MI,48223,,,Worker was crushed by a branch that was cut from a large oak tree.
FY 2012,12/17/11,12/9/11,Kraft Foods North America, Farmington Hills,MI,48335,,,Worker's head was crushed between the rear of a trailer and a warehouse door.
FY 2012,6/23/12,6/19/12,Powers Distributing Company, Orion,MI,48359,,,Worker at a brewery warehouse died from injuries when he fell from a trailer onto the cement ground.
FY 2012,3/24/12,3/1/12,Professional Roofing Services Inc., Ortonville,MI,48433,,,Worker performing roofing activities was electrocuted while moving a ladder that touched an overhead power line.
FY 2012,10/8/11,9/29/11,Integral Bldrs LLC, Dewitt,MI,48820,,,"Worker building an addition on a barn was electrocuted after touching a 4,800-volt powerline."
FY 2012,2/11/12,2/8/12,Larry Simon Dairy Farm, Westphalia,MI,48894,,,Worker was run over and killed by a front-end loader.
FY 2012,10/1/11,9/20/11,A-1 Tree and Landscape, Lansing,MI,48911,,,"Worker cutting trees died after a falling branch struck him, causing him to fall 40 feet."
FY 2012,6/23/12,6/22/12,Consumers Energy, Jonesville,MI,49028,,,Worker assessing the damage to downed power lines was struck and killed by a vehicle.
FY 2012,7/14/12,7/12/12,Thomas Logging LLC, Climax Twp,MI,49034,,,Worker was crushed by a tree while cutting timber.
FY 2012,12/17/11,12/13/11,Pulverdryer USA, Springfield,MI,49037,,,Worker was electrocuted after touching a 480-volt plug.
FY 2012,6/9/12,6/5/12,Renewed Earth, Otsego,MI,49078,,,Worker operating a screening machine was killed when he was pulled into the machine.
FY 2012,7/28/12,7/25/12,Next Specialty Resins, Addison,MI,49220,,,Worker at a plastics recycling plant died after falling into an industrial grinding machine.
FY 2012,6/9/12,6/6/12,Nu Pak Solutions Inc., Norton Shores,MI,49441,,,Worker at a styrofoam packaging plant was crushed by a press machine.
FY 2012,11/12/11,11/4/11,Sun Chemical Corporation, Muskegon,MI,49442,,,"Worker was crushed by a 1,500 pound bag of pigment that fell on him."
FY 2012,7/7/12,7/2/12,Black River Builders, Zeeland,MI,49464,,,Worker performing roof repairs died after falling nearly 25 feet through the roof.
FY 2012,6/2/12,2/21/12,Department of Human Services, Grand Rapids,MI,49507,,,A caseworker was shot and killed by a client who was upset about his benefits being denied.
FY 2012,6/23/12,6/18/12,Mill Steel Company, Grand Rapids,MI,49508,,,"Worker moving steel coils was crushed when one of the 8,000-pound coils fell on him."
FY 2012,10/8/11,9/19/11,The Indian Club, Irons,MI,49644,,,Worker suffered burns and died from asphyxiation after a storage facility fire.
FY 2012,7/7/12,7/3/12,Express Tire Service Inc., Kalkaska,MI,49646,,,"Worker was changing a tire on a piece of farm equipment when it exploded, striking and killing worker."
FY 2012,11/19/11,11/16/11,Leelaunau Fruit Co., Suttons Bay,MI,49682,,,Worker was asphyxiated in a brine pit while transferring cherries from a brine pit to truck.
FY 2012,1/28/12,12/15/11,J F Ahern Co., Escanaba,MI,49829,,,Employee was found next to a fire extinguisher the worker was inspecting.
FY 2012,6/2/12,5/30/12,Manistique Papers Inc., Manistique,MI,49854,,,"Worker using powered industrial truck to remove paper rolls was killed when the truck tipped over, crushing the worker."
FY 2012,1/7/12,12/28/11,Volt Workforce Solutions, St. Paul,MN,55107,,,Worker stripping and waxing floors died from a heart attack. There will be no OSHA inspection.
FY 2012,3/31/12,3/19/12,Home Goods, Oakdale,MN,55128,,,"Worker at a retail store, setting up a bag holder, died when a metal piece from the holder struck him in the head."
FY 2012,6/23/12,6/5/12,Veit & Company Inc., Rogers,MN,55374,,,Worker operating a drill rig died from head trauma when he fell from the machine's broken seat.
FY 2012,6/30/12,6/21/12,BPS Inc., Minneapolis,MN,55413,,,Worker at a metal manufacturing facility was killed after being crushed by a pile of steel.
FY 2012,1/28/12,1/20/12,Peine Construction Corp., Edina,MN,55424,,,Worker was struck by a truss and fell.
FY 2012,4/21/12,3/14/12,Premier Precision Group-Sternel, Plymouth,MN,55441,,,Worker performing painting services died from cardiac arrest.
FY 2012,10/1/11,9/27/11,Blooming Prairie Well Co., Blooming Prairie,MN,55917,,,Worker was killed after he was struck in head by a 35-pound weight that fell 30 feet from a broken cable.
FY 2012,4/7/12,4/2/12,Rumstick Construction Inc., Rollingstone,MN,55969,,,Worker performing residential construction died after falling 14 feet from a ladder.
FY 2012,9/8/12,9/1/12,CR Koehl and Sons Inc., Hancock,MN,56244,,,Worker died after the semi-tractor/trailer he was driving overturned.
FY 2012,3/10/12,2/27/12,Border Bin Erection LLC, Kerkhoven,MN,56252,,,Worker was struck by grain-bin jack.
FY 2012,10/1/11,2/21/11,Viking Coca Cola Bottling Company, St. Cloud,MN,56303,,,Worker at a soda bottling company was found dead inside a walk-in freezer.
FY 2012,6/2/12,5/28/12,Verso Paper, Sartell,MN,56307,,,"Worker at a paper mill was killed when an air compressor inside the building exploded, causing a fire."
FY 2012,5/19/12,5/17/12,ACME Tools and Rentals, Bemidji,MN,56601,,,Worker inside an elevated lift bucket was electrocuted when the lift touched an energized wire.
FY 2012,8/25/12,8/21/12,White Brothers Logging, Cass Lake,MN,56633,,,Worker was struck and killed by tree pines that slipped out of boom truck.
FY 2012,3/10/12,3/7/12,Sieveking Inc., Hazelwood,MO,63042,,,Worker using a portable ladder to hook a hose to a fuel tank truck died after falling 10 feet off the ladder to pavement.
FY 2012,1/7/12,12/20/11,Ameren UE, Labadie,MO,63055,,,Worker died after falling 80 feet from a scaffold.
FY 2012,1/14/12,1/10/12,Butler Merchandising Solutions, St. Louis,MO,63106,,,Worker was crushed by the Brause clam shell press machine he was operating.
FY 2012,6/23/12,6/18/12,Kaiser Electric, St. Louis,MO,63110,,,Worker climbing a ladder to access a roof died after falling more than 20 feet.
FY 2012,7/14/12,7/11/12,L & C Exteriors, Overland,MO,63114,,,Worker pulling a roller on a flat roof died after falling through a skylight.
FY 2012,5/12/12,5/7/12,Schoeder & Tremayne, St. Louis,MO,63123,,,"Warehouse worker operating a forklift died when the metal plate that bridges the gap between the loading dock and truck gave way, causing him to fall 6 feet off the dock."
FY 2012,5/12/12,5/9/12,Contractors Roofing & Supply Co., Lake Sherwood,MO,63357,,,Worker was electrocuted when the boom of the roofing supply truck contacted power lines hidden within tree branches.
FY 2012,6/2/12,5/25/12,Tri-State Timber LLC, New Cambria,MO,63558,,,Worker cutting down trees died when a tree fell on him.
FY 2012,7/7/12,7/2/12,Chester Bross Construction Co. Inc., Bloomsdale,MO,63627,,,Worker was doing highway construction and was struck and killed by a dump truck.
FY 2012,5/12/12,5/7/12,Penzel Construction Co., Jackson,MO,63755,,,Worker assembling a crawler crane at a construction site was killed when his head was crushed between the crane's uncarriage and support pads.
FY 2012,6/2/12,5/29/12,Jim's Disposal Service LLC, Kansas City,MO,64118,,,Worker riding on the back of a trash truck was killed when he fell off and was run over by the truck.
FY 2012,5/19/12,5/16/12,Missouri American Water, Joplin,MO,64804,,,"Worker cutting pipe with a pipe saw died when the saw kicked back, striking the worker in the throat."
FY 2012,6/9/12,6/6/12,McAlester Army Ammunition Plant, Fort Leonard Wood,MO,65473,,,Railroad maintenance worker died after being struck by a rolling rail car.
FY 2012,11/12/11,11/6/11,Midwest Coatings, Branson,MO,65616,,,Worker applying fire retardant material to steel beams of an apartment complex died after falling from the elevated platform.
FY 2012,11/5/11,11/3/11,Paul Mueller Company, Springfield,MO,65802,,,Worker serving as a spotter was crushed between a truck and tractor trailer.
FY 2012,11/26/11,11/16/11,Producers Gin of Belen, Marks,MS,38646,,,Worker operating a cotton press was killed when she was hit by parts of the machine after it blew up.
FY 2012,7/21/12,7/19/12,Tombigee Electric Power Association, Fulton,MS,38843,,,Worker cutting down trees was struck and killed by a falling tree.
FY 2012,3/3/12,2/23/12,Best Foam, Sherman,MS,38869,,,Worker operating a compactor machine used to pack together cut farm crops died after being caught inside the machine.
FY 2012,1/28/12,1/19/12,Live Oaks Planting Company LLC, Itta Bena,MS,38941,,,"Employee was working in a 60,000 bushel grain silo when the worker sank and was engulfed in 20,000 bushels of soybean."
FY 2012,4/28/12,4/10/12,Parker Logging, Brandon,MS,39042,,,Worker cutting down trees was struck and killed by a falling tree.
FY 2012,7/21/12,7/13/12,Dean Construction, Canton,MS,39288,,,Worker installing skylights died after falling 20 feet onto concrete floor.
FY 2012,1/21/12,12/12/11,Oilfield Service & Supply Company Inc., Laurel,MS,39443,,,"Worker was removing a ladder stuck in mud and briars. The ladder flew up and hit the worker on the back, fatally injuring the worker."
FY 2012,7/7/12,7/2/12,Tri-State Pole & Piping Inc., Lucedale,MS,39452,,,Teenage worker helping to stack a bundle of poles was killed when one pole struck his head.
FY 2012,1/7/12,1/4/12,MDR Construction, Moselle,MS,39459,,,Worker was electrocuted while performing overhead powerline construction.
FY 2012,9/15/12,9/9/12,Southern Hens Inc., Moselle,MS,39459,,,Employee cleaning the processing area in a poultry plant died after falling into a screw conveyor.
FY 2012,4/14/12,4/6/12,Looks Great Services of MS Inc., Sumrall,MS,39482,,,Worker was performing tree trimming and was struck by a falling tree.
FY 2012,4/14/12,4/2/12,Progressive Products and Service, Gulfport,MS,39505,,,Worker making repairs to a boat died after falling 12 feet from the boat's deck.
FY 2012,4/14/12,4/9/12,Omega Protein, Moss Point,MS,39562,,,Worker at a seafood plant was killed when he was caught in a conveyor used to move liquids and grain materials.
FY 2012,2/4/12,1/30/12,V T Halter Marine Inc., Pascagoula,MS,39581,,,Worker preparing to refill a sand blast pot was killed when the pressurized vessel exploded after he lifted the lid.
FY 2012,6/2/12,6/1/12,Mississippi Phosphates Corp., Pascagoula,MS,39581,,,Worker died from burns after a pipe from the steam system he was checking exploded.
FY 2012,8/4/12,5/21/12,Mississippi Phosphate Corp., Pascagoula,MS,39581,,,Worker performing equipment maintenance at a phosphate fertilizer plant died during a steam explosion.
FY 2012,1/14/12,12/20/11,Bowllin Logging, Brookhaven,MS,39601,,,Worker was struck and killed by a tree he was cutting down.
FY 2012,6/30/12,6/26/12,Lane Line LLC, Brookhaven,MS,39601,,,Worker performing measurements inside a workzone was struck and killed by a company truck.
FY 2012,9/22/12,9/13/12,Mr Asphalt Inc., Corvallis,MT,59828,,,Worker died after falling approximately 13 ft while checking the level of an asphalt oil tank.
FY 2012,9/29/12,9/13/12,Mr Asphalt Inc., Corvallis,MT,59828,,,Worker died after falling approximately 13 ft while checking the level of an asphalt oil tank.
FY 2012,9/22/12,9/20/12,Bonneville Power Administration, Saint Regis,MT,59866,,,Worker died after falling approximately 80 feet while replacing insulators.
FY 2012,9/29/12,9/20/12,Bonneville Power Administration, Saint Regis,MT,59866,,,Worker died after falling approximately 80 feet while replacing insulators.
FY 2012,1/7/12,1/3/12,TA Operating, Hillsborough,NC,27278,,,Worker was struck and killed by a metal pry bar when working on the brakes of a vehicle.
FY 2012,7/28/12,7/27/12,Southern Investments LLC, Reidsville,NC,27320,,,Worker cutting wire off baled recyclable plastics was killed after being pulled into an auger.
FY 2012,6/23/12,6/13/12,Parmass Holdings Inc. dba Envision Plastics, Reidsville,NC,27323,,,Worker performing equipment maintenance was electrucuted.
FY 2012,7/28/12,7/26/12,Evonik Stockhausen LLC, Greensboro,NC,27406,,,Worker was pinned between a commercial carrier cab and a trailer.
FY 2012,3/31/12,3/24/12,Daniel Coates Farm, Fuquay Varina,NC,27526,,,Farm worker was struck and killed when a box of feed stock fell on him.
FY 2012,6/9/12,6/1/12,Waukesha Electric Systems Inc., Goldsboro,NC,27530,,,Worker died from electrical burns received while testing a transformer.
FY 2012,1/7/12,12/23/11,Schwerman Trucking Company, Raleigh,NC,27610,,,"Worker transferring a product from a tanker died from injuries when a pressurized vessel cover struck him, causing him to fall."
FY 2012,12/3/11,11/23/11,Parnell & Son Drywall Inc., Raleigh,NC,27614,,,"Worker making repairs in a church attic without using fall protection, died when he fell through the ceiling to the concrete floor."
FY 2012,11/19/11,10/14/11,Six Forks Cinema, Raleigh,NC,27615,,,Worker fell at movie theater.
FY 2012,5/12/12,5/10/12,Pike Electric Corporation, Elm City,NC,27822,,,Worker had one hand on a truck that became energized and the electricity flowed through the worker's body.
FY 2012,7/14/12,7/2/12,W.W. Landscaping Inc., Pinetops,NC,27864,,,Worker cutting down a nearly 100-foot-high pine tree was struck and killed by another falling tree.
FY 2012,11/19/11,11/9/11,Town of Lucama, Wilson,NC,27893,,,Worker attempting to move a service pole while inside a bucket truck died after falling more than 50 feet when the pole fell on the bucket.
FY 2012,2/18/12,2/8/12,Con-Way Southern Express, Columbia,NC,27925,,,Worker caught between a truck and a loading dock died from injuries.
FY 2012,2/11/12,1/16/12,Proof Seal LLC, Bessemer City,NC,28016,,,Worker died after falling 16 feet through a skylight to a concrete floor.
FY 2012,11/19/11,10/27/11,Team Carolinas, China Grove,NC,28023,,,Pizza delivery worker died from head injuries after falling from front porch striking his head on the sidewalk.
FY 2012,7/7/12,6/29/12,S&S Graham Archery Sales Inc., China Grove,NC,28023,,,"Worker using acetone to perform taxidermy activities was killed when the pilot light from a water heater ignited the acetone vapors, causing a fire."
FY 2012,5/5/12,5/8/12,Knott Construction Inc., Forest City,NC,28043,,,Worker at a construction site was killed after he was hit on the head by a steel pipe that broke from a piece of scrap metal.
FY 2012,3/31/12,3/30/12,Huntersville Hardwoods Inc., Huntersville,NC,28070,,,Worker was struck and killed by a fork truck while walking to a break area.
FY 2012,4/21/12,4/20/12,Robert Ochoa dba Robert Ochoa, Mooresville,NC,28117,,,Worker repairing a residential roof died after falling 13 feet onto a concrete driveway.
FY 2012,3/31/12,3/27/12,HD Supply Waterworks, Pineville,NC,28134,,,"Worker for a plumbing supplies company who was loading materials on a flatbed truck died when he fell 4 feet off the truck, and was then struck by a 420-pound pipe."
FY 2012,6/23/12,6/22/12,Dustin Ellis dba Dustin Ellis Logging, Stanley,NC,28164,,,Worker cutting down trees was killed when a tree struck him.
FY 2012,4/28/12,3/24/12,A and A Farms Inc., Bunnlevel,NC,28323,,,Farm worker was killed after a box of seed potatoes fell on him.
FY 2012,2/25/12,2/18/12,Smithfield Packing Company Inc., Clinton,NC,28328,,,Worker emptying waste water sludge into a tanker truck died from exposure to toxic gas.
FY 2012,10/1/11,9/26/11,Murphy-Brown, Laurinburg,NC,28352,,,Worker trying to access an auger motor died after becoming entangled in the machine.
FY 2012,4/21/12,4/18/12,Lewis Nursery and Farms Inc., Rocky Point,NC,28457,,,Worker was killed after his leg became caught in coiled rope that was being pulled onto a post by a spooling machine.
FY 2012,11/26/11,11/20/11,Tri-County Electric Membership Corporation, Seven Springs,NC,28578,,,Worker performing electrical repair was killed when he was thrown from the bucket truck after it was hit by a tractor trailer.
FY 2012,4/7/12,4/3/12,Outdoor Advertising Services, Snow Hill,NC,28580,,,Worker setting up a metal ladder alongside a billboard was electrocuted when the ladder touched a power line.
FY 2012,12/3/11,11/29/11,Jones County Cotton Gin, Trenton,NC,28585,,,"Worker was killed after four bales of cotton, each weighing 500 pounds, fell on top of him."
FY 2012,3/3/12,2/21/12,Brunner Equipment LLC, Elkin,NC,28621,,,Worker was killed when a hydraulic lift fell on him.
FY 2012,8/25/12,8/20/12,Sammy Coffeys Wholesale Nursery Inc., Lenoir,NC,28645,,,Worker was struck by a tree that was being cut down.
FY 2012,12/3/11,11/21/11,New River Tree Company, West Jefferson,NC,28694,,,Worker died when he fell 10 feet from a trailer while unloading trees.
FY 2012,12/3/11,11/18/11,Lankford Protective Services, Lake Junaluska,NC,28745,,,Worker died when he slipped down the stairs and struck his head.
FY 2012,4/14/12,4/11/12,NC Dept. of Public Safety, Spruce Pine,NC,28777,,,Worker sustained a fatal head injury after falling down stairs.
FY 2012,8/4/12,8/3/12,NC Department of Transportation, Murphy,NC,28906,,,Two workers were struck-by and pinned against the back of a dump truck after being hit by a vehicle.
FY 2012,2/4/12,1/27/12,Patterson UTI, Keene,NC,58847,,,Worker was killed in a boiler explosion on an oil drilling rig.
FY 2012,6/2/12,5/25/12,Scott's Electric Inc., West Fargo,ND,58078,,,Worker installing electrical conduits in a building under construction was struck on the head and killed by a 28-foot steel beam.
FY 2012,6/30/12,6/27/12,Midwest Steeplejacks, Fargo,ND,58104,,,Worker died after falling 153 feet from a cellphone tower.
FY 2012,9/15/12,9/9/12,S.J. Louis Construction Inc., Bismarck,ND,58501,,,Trench worker killed after being pinned between track hoe and 24-inch pipe.
FY 2012,4/14/12,4/2/12,A&R Construction, Dickinson,ND,58601,,,"Worker unloading pipes from a flatbed truck was killed when the pipes came loose and hit worker, causing him to fall to the ground."
FY 2012,1/7/12,12/20/11,CR Petersen, Dickinson,ND,58601,,,Worker was engulfed when the sewer and water trench he was digging caved in.
FY 2012,8/11/12,8/6/12,Big Sky Well Service Inc., Killdeer,ND,58640,,,Worker died after falling approximately 75 feet from a service rig.
FY 2012,1/14/12,1/7/12,Across Big Sky Flow Testing, Killdeer,ND,58640,,,Worker switching tanks at a flow testing facility was found dead on the catwalk of a tank battery.
FY 2012,2/4/12,1/31/12,Trans Power Electric, New Town,ND,58763,,,Worker was struck and killed by a backhoe blade during electrical installation operations.
FY 2012,3/10/12,3/2/12,Frontier Drilling LLC, Palermo,ND,58769,,,"Worker performing piping work died from injuries sustained when his life line broke, causing him to fall 75 feet."
FY 2012,2/18/12,2/16/12,Key Energy Services Inc., Plaza,ND,58771,,,Worker operating equipment that injected nitrogen into an oil well was found dead.
FY 2012,8/25/12,8/15/12,Steamboat Energy Consultants, Williston,ND,58801,,,Worker overseeing the operation of an oil rig was struck and killed by a truck.
FY 2012,2/11/12,2/3/12,KKA Drilling LLC, Keene,ND,58847,,,Worker died after falling 14 feet during rig tear-down operations.
FY 2012,11/5/11,10/27/11,Noble Casing Incorporated, Watford City,ND,58854,,,Worker was killed in a vehicle roll-over incident while enroute to a job site.
FY 2012,9/15/12,9/14/12,Danlin Corp, Cedar Bluffs,NE,68015,,,Employee working on a roof died from injuries after falling 20 feet to the ground.
FY 2012,1/28/12,1/26/12,Bimbo Bakeries USA, Omaha,NE,68134,,,Worker was pinned by a panel van truck against the wall of the building.
FY 2012,7/7/12,6/24/12,T.H. Construction Company, Bennet,NE,68317,,,Worker using a pipe wrench to loosen the cap from an utility line was killed when the wrench struck his head.
FY 2012,4/28/12,4/24/12,Quality Power & Control, Allen,NE,68710,,,Worker performing electrical services was electrocuted.
FY 2012,3/17/12,3/14/12,Tyson Fresh Meats Inc., Dakota City,NE,68731,,,Worker repairing an adjustable lift platform inside a meat packing facility was crushed when the chain holding the platform broke.
FY 2012,1/7/12,12/7/11,Eaton Corporation, Kearney,NE,68848,,,Worker was caught between bar steel feeder and press.
FY 2012,2/11/12,1/18/12,Hastings Acquisitions, Hastings,NE,68901,,,Worker dies when he is pulled into a conveyor after his scarf gets caught in the machine.
FY 2012,10/8/11,9/30/11,Commercial Construction, Kearney,NE,68924,,,Worker using a dozer to fill a lake with sand drowned when the sand could not support the equipment's weight.
FY 2012,2/11/12,2/1/12,Wauneta Mills LLC, Wauneta,NE,69045,,,Worker using an auger to fill truck with feed pellets was found dead inside the truck bin.
FY 2012,3/31/12,2/23/12,FM Property Services, Union,NJ,,,,Worker died after falling eight feet while installing ceiling tiles from a ladder.
FY 2012,8/11/12,7/25/12,Circle Rubbish Removal Inc., Avenel,NJ,7001,,,Employee suffered fatal head and spine injuries after falling off of a dumpster.
FY 2012,1/28/12,1/20/12,Garfield Lumber and Millwork, Garfield,NJ,7026,,,"Worker was working underneath a forklift when the jack used to lift the forklift failed, crushing the worker."
FY 2012,6/2/12,5/25/12,Hummel Machine & Tool Co., Kearny,NJ,7032,,,Worker operating a lathe machine at a tool and machine company died after a piece of flying glass cut his neck.
FY 2012,9/29/12,8/22/12,New Jersey Transit Heavy Rail Kearny,,NJ,7032,,,Worker performing maintanence underneath railroad equipment when hydraulic line disconnected and equipment lowered crushing worker.
FY 2012,12/10/11,12/3/11,Champion Construction Co., North Bergen,NJ,7047,,,Worker operating a tilt frame truck used to place a roll-off container onto the truck was killed when an anchorage point broke free and struck him on the head after it was propelled through the rear window of the truck cab.
FY 2012,2/4/12,1/26/12,Prestige Exterior Maintenance LLC, North Bergen,NJ,7047,,,Worker was crushed by the arm of a skid steer.
FY 2012,12/24/11,12/16/11,Airserv Corporation, Union,NJ,7083,,,Worker was struck and killed by a bus.
FY 2012,5/26/12,5/18/12,ASAP Seamless Gutters, Secaucus,NJ,7094,,,Worker died after being ejected from a 40-foot high aerial lift basket.
FY 2012,11/19/11,11/14/11,Vollers Excavating & Construction, Newark,NJ,7102,,,Worker was struck and killed by a vehicle at the edge of a parking lot driveway.
FY 2012,12/31/11,12/30/11,T. Fiore Demolition, Newark,NJ,7105,,,Worker died after he was caught in a moving conveyor belt.
FY 2012,7/21/12,7/16/12,Fino Electric, Newark,NJ,7105,,,Worker fell 35 feet from an aerial lift basket.
FY 2012,1/14/12,1/9/12,D&J Marangi, Newark,NJ,7108,,,Worker was run over by a garbage truck while on a collection route.
FY 2012,3/24/12,2/22/12,Port Newark Container Terminal LLC, Newark,NJ,7114,,,Worker at a container terminal died after being caught between two cargo containers.
FY 2012,6/30/12,6/14/12,Joy Construction, Ridgewood,NJ,74506,,,Worker was struck on the head and killed by flying debris.
FY 2012,8/11/12,8/6/12,D.R. Exteriors LLC, West Milford,NJ,7480,,,Roofing worker died after falling approximately 30 feet from a residential roof.
FY 2012,10/1/11,9/20/11,Al and John, Paterson,NJ,7503,,,Worker cleaning a meat mixer died when he fell into the machine.
FY 2012,4/28/12,4/14/12,D Barro Landscaping Service Inc., Leonia,NJ,7605,,,Worker repairing an uprooted sidewalk at a construction site was crushed after a concrete slab hanging from a bobcat fell on him.
FY 2012,8/11/12,8/3/12,Jersey Central Power & Light Company, Manalapan,NJ,7726,,,Employee was electrocuted while working on a downed wire.
