Fiscal Year ,Summary Report Date,Date of Incident,Preliminary Description of Incident,City,State,Zipcode,,,
FY 2012,10/22/11,10/5/11,Stovens Brothers Water Wells, Hampden, MA,1036,,,Worker drilling a hole for a well died after he stepped back and fell 10 feet down into water.
FY 2012,10/15/11,10/7/11,Soil & Material Testing, Williamstown, MA,1267,,,Worker was crushed under the front and rear tires of a powered industrial vehicle.
FY 2012,10/22/11,10/19/11,All-Town, Marshfield, MA,2050,,,Worker rotating truck tires was killed when one of the rings holding the tire in place struck him in the head.
FY 2012,10/22/11,10/18/11,Complete Coverage Inc., North Kingstown, RI,2852,,,Worker replacing a roof was killed after falling 47 feet.
FY 2012,10/29/11,10/25/11,American Building, Stamford, CT,6902,,,Worker installing metal roof panels died from head injuries after falling 35 feet to the ground.
FY 2012,10/29/11,10/25/11,EAL Fig LLC dba 5-Point Tire & Auto Repairs, Camden, NJ,8105,,,Worker was struck and killed when a tool disk struck him in the chest.
FY 2012,10/29/11,10/29/11,Anibal Landscaping Corp., Jamaica, NY,11435,,,Landscape worker riding in the back of a truck died from carbon monoxide fumes after he used a gas-powered lawn mower to keep warm.
FY 2012,10/29/11,10/20/11,NYSDOT Bridge Maintenance Shop, Warrensburg, NY,12885,,,Worker inspecting a bridge died after he was pinned between bridge and lift basket.
FY 2012,10/15/11,10/4/11,Gregory Dodge (DBA), Munnsville, NY,13409,,,Worker died from head injuries after falling from a roof.
FY 2012,10/15/11,10/7/11,Jeff Rotella Transport Corp., Manheim, PA,17545,,,Worker disconnecting an airline underneath a truck was asphyxiated when his head was caught between the spare tire and a bracket.
FY 2012,10/15/11,10/14/11,Visions Telecommunications, Pinch, WV,25156,,,Worker installing cable between utility poles was electrocuted.
FY 2012,10/22/11,10/17/11,Moores Contracting Services LLC, Buckhannon, WV,26201,,,Worker died after falling 35 feet through the doorway of a silo-type structure.
FY 2012,10/29/11,10/26/11,Simon Roofing and Sheet Metal Corp., Charlotte, NC,28262,,,Worker unclogging trash chute died after falling 40 feet when the chute collapsed.
FY 2012,10/29/11,10/25/11,Cumberland Garage and Trash Service, Fayetteville, NC,28306,,,Worker riding on rear of trash truck was killed when he fell under the truck traveling in reverse.
FY 2012,10/22/11,10/4/11,Klin Drying Systems and Components, Etowah, NC,28729,,,Worker operating a metal cutting machine was killed when caught between machine's back gauge and top plate.
FY 2012,10/22/11,10/13/11,Grove River Mills, Monroe, GA,30656,,,"Worker operating a truck's boom was electrocuted when the boom touched a 14,400-volt power line."
FY 2012,10/15/11,10/6/11,IRBY Construction Company, Sandersville, GA,31082,,,Worker assisting on a power transmission line was electrocuted when he touched a loose cable.
FY 2012,10/22/11,10/21/11,K.P. Meiring Company, St. Augustine, FL,32084,,,Worker repairing a roof died after stepping on a metal sheet that covered a hole and falling 20 feet.
FY 2012,10/29/11,10/24/11,Orestes Lescano, Miami, FL,33130,,,Worker installing weather stripping at an apartment building was killed after falling 40 feet.
FY 2012,10/29/11,10/22/11,Sante Shipping Lines, Miami, FL,33142,,,Worker inspecting a vessel's cargo from a suspended man basket died after equipment failure caused him to fall 18 feet to the ground.
FY 2012,10/29/11,10/16/11,Esther's 103, Miami, FL,33150,,,Worker trying to replace pumps inside a manhole collapsed and later died from exposure to toxic air.
FY 2012,10/22/11,10/13/11,Sams Discount Grocery, Tampa, FL,33610,,,Worker was shot and killed during a robbery.
FY 2012,10/29/11,10/20/11,Hilltop Tune, Pelham, AL,35124,,,Worker repairing an SUV was killed when the truck slipped into gear and ran over him.
FY 2012,10/15/11,10/5/11,Wayne Farms, Decatur, AL,35602,,,Worker was crossing a road on company property and was struck and killed by a vehicle.
FY 2012,10/22/11,10/17/11,PCH Hotels and Resorts, Mobile, AL,36602,,,Worker was electrocuted while repairing a hotel room air conditioning unit.
FY 2012,10/29/11,10/25/11,Dickson Dept. of Public Works, Dickson, TN,37055,,,Worker was struck ad killed by a falling tree limb.
FY 2012,10/22/11,10/13/11,Walden General Contractors Inc., Lebanon, TN,37090,,,Worker died after falling down a flight of stairs.
FY 2012,10/29/11,10/21/11,Lawrence Construction & Leasing, Florence, KY,41042,,,"Pipe layer was killed when a testing machine he was using swung around, striking him in the head."
FY 2012,10/22/11,10/2/11,The Associated Press, Sparta, KY,41086,,,Photographer on assignment at a race track suffered fatal head injuries after falling on track.
FY 2012,10/15/11,10/7/11,B & B Contracting, Paintsville, KY,41240,,,Worker traveling to another work location fell out of back of truck and struck head on ground.
FY 2012,10/15/11,10/10/11,Roger Kreps Drywall & Plaster, Lisbon, OH,44432,,,Worker died after falling 14 feet from a roof onto the concrete floor.
FY 2012,10/29/11,10/23/11,Quality Castings, Orrville, OH,44667,,,Worker using a wheelabrator machine died of complications sustained when his finger was amputated.
FY 2012,10/15/11,10/6/11,Dean A. Bowman, Troy, OH,45373,,,Worker performing indoor construction died when he fell nearly 20 feet from the second floor to the basement.
FY 2012,10/15/11,10/12/11,Centimark Corporation, Lima, OH,45804,,,Worker was performing roofing work on a melt shop and was fatally injured.
FY 2012,10/15/11,10/7/11,Airtite Insulation, Goshen, IN,46528,,,Worker suffocated after falling into a pit of insulation.
FY 2012,10/29/11,10/25/11,Nucor, Crawfordsville, IN,47933,,,Worker was run over and killed by machine.
FY 2012,10/22/11,10/13/11,Walker Police/Fire Department, Walker, MI,49534,,,Police Officer laying a spike strip was run over and killed by suspect vehicle during police chase.
FY 2012,10/22/11,9/30/11,Art Rodriguez, Colfax, IA,50054,,,Roof worker died when he fell 20 feet after stepping on a fiberglass skylite.
FY 2012,10/22/11,10/15/11,W.A. Klinger, Sioux City, IA,51104,,,"Construction worker died from fatal head trauma when a wall collapsed, crushing him."
FY 2012,10/15/11,10/12/11,L & D Sign, Centreville, MN,55038,,,Worker repairing commercial sign was electrocuted after touching live electrical parts.
FY 2012,10/15/11,10/13/11,Egan Company, Burnsville, MN,55337,,,One worker killed and one injured after being struck by a vehicle that entered a construction zone after going off road.
FY 2012,10/22/11,10/19/11,Blackowiak Disposal Inc., Mound, MN,55364,,,Worker removing debris from back of trash truck was crushed between truck's cart tipper and the loading dock.
FY 2012,10/29/11,10/18/11,Advantage Plumbing & Heating, Mencken, ND,58558,,,Trench engulfment.
FY 2012,10/29/11,10/19/11,Midco Diving & Marine Services, Parshall, ND,58770,,,Water treatment plant worker diving into a 138-foot-deep chamber to perform maintenance died after his umbilical line failed.
FY 2012,10/29/11,10/20/11,Metro Construction, Mckenzie, ND,58854,,,Truck driver hauling gravel was killed when his truck tipped over.
FY 2012,10/15/11,10/8/11,Mondi USA, Romeoville, IL,60446,,,Worker lubricating a chain on an automation conveyor died after falling 9 feet from an I-beam to the concrete floor.
FY 2012,10/15/11,10/10/11,Unnerstall Contracting Co., St. Louis, MO,63146,,,Worker was found unconscious in a manhole.
FY 2012,10/15/11,10/10/11,Gulf Island, Houma, LA,70361,,,Worker was killed when a load of metal plates he was moving fell on top of him.
FY 2012,10/29/11,10/28/11,Harris Quality Inc., Fort Worth, TX,76140,,,Worker was found crushed between truck and loading dock.
FY 2012,10/15/11,10/10/11,Woodhaven Industries, Sugar Land, TX,77498,,,Worker died of a possible heart attack after collapsing while unloading his work truck.
FY 2012,10/29/11,10/21/11,Hilario Valero, San Antonio, TX,78245,,,Worker applying siding on a chimney died after falling 18 feet.
FY 2012,10/15/11,10/6/11,Kelley Trucking, Bailey, CO,80421,,,Worker was struck and killed by a rock while at a construction site.
FY 2012,10/15/11,9/29/11,Greenes, Draper, UT,84020,,,Worker hit and killed by dump truck while removing temporary traffic control barrels.
FY 2012,10/29/11,10/15/11,Boat Grotto, San Diego, CA,92115,,,Mechanic died from possible aneurism and heart attack after making repairs to boat engine.
FY 2012,10/15/11,9/26/11,Kenai Drilling Limited, Ventura, CA,93001,,,Worker was crushed by a piece of drill equipment while working in oilfields.
FY 2012,10/15/11,10/12/11,Community Recycling and Resource Recovery, Lamont, CA,93241,,,Worker died after being overcome by toxic fumes while cleaning the inside of a drain pipe.
FY 2012,10/15/11,10/12/11,Granite Rock Concrete, La Honda, CA,94020,,,Worker was killed when the loaded concrete mixer truck he was driving rolled over.
FY 2012,10/29/11,10/25/11,G & S Paving, Palo Alto, CA,94304,,,Worker was run over by a semi-truck traveling in reverse.
FY 2012,10/29/11,10/17/11,Cherokee Freight Lines Stockton, St. Helena, CA,94574,,,"Worker tripped and fell while walking on job site, hitting his head on a step. Worker later suffered a heart attack at hospital."
FY 2012,10/22/11,10/19/11,Performance Abatement Service, Berkeley, CA,94709,,,Worker in full suit and mask died from a seizure while removing asbestos.
FY 2012,10/15/11,10/13/11,General Mills, Lodi, CA,95242,,,Worker attempting to stop a moving railcar was crushed between railcar and dock.
FY 2012,10/22/11,10/20/11,Calpine, Middletown, CA,95461,,,Worker went off a cliff.
FY 2012,10/22/11,10/20/11,Mark Dewsnup, Marysville, CA,95901,,,Worker was killed after he was run over by a farm tractor.
FY 2012,10/15/11,10/13/11,PG & E, Bolden, CA,95915,,,Two workers died after their work truck sank 25 feet in a reservoir.
FY 2012,10/29/11,10/3/11,Landmark Pacific Builders Inc., Honolulu, HI,96817,,,Residential construction worker renovating roof died after falling two stories.
FY 2012,10/29/11,10/22/11,A-1 Self Storage LLC, Seattle, WA,98119,,,Manager of self storage facility was stabbed during a robbery.
FY 2012,10/15/11,9/15/11,LVI Environmental Services, Seattle, WA,98121,,,Worker removing debris with skid loader died when punctured in the neck by protruding rebar.
FY 2012,10/15/11,9/19/11,Furrer Construction Inc., Woodland, WA,98674,,,Worker pressure washing exterior of silo was electrocuted after contacting a high voltage line.
FY 2012,10/15/11,10/4/11,Novelis Corporation, Oswego, NY,13126,,,Worker was connecting hoses inside a machine and was crushed between the machine's support block and bulkhead.
FY 2012,11/5/11,10/29/11,Bartlett Grain Company, Atchison,KS,66002,,,Four workers were killed in a grain elevator explosion and fire.
FY 2012,1/7/12,12/30/11,Hammacher, West Chester,OH,45069,,,Worker died after slipping and falling off a commercial building roof.
FY 2012,8/18/12,8/16/12,Hammett Electric Inc., Wooster,AK,72181,,,Worker was electrocuted while installing wiring at a residence under construction.
FY 2012,7/7/12,6/21/12,Rosiek Construction Co., Blytheville,AK,72315,,,Worker performing construction activities collapsed and died from possible heat stress.
FY 2012,11/12/11,11/3/11,Trucano Construction Company, Juneau,AK,99801,,,Worker loading construction equipment died when he was caught between a toppled crane and a railing off the deck barge.
FY 2012,3/31/12,3/13/12,Alaska Heliskiing LLC, Hanes,AK,99827,,,Worker at a snow ski resort was buried under nearly eight feet of snow after an avalanche.
FY 2012,9/8/12,8/11/12,Phoenix Logging Company, Prince of Wales Island,AK,99922,,,Worker banding together logs was struck and killed by a falling log.
FY 2012,3/3/12,2/22/12,Alabama Forklift & Repair Inc., Clanton,AL,35045,,,Worker trying to remove the oil filter from underneath a forklift was killed when the jack used to elevate the forklift fell on him.
FY 2012,3/24/12,3/6/12,Daniel Smith, Holly Pond,AL,35083,,,Worker performing logging operations died from head injuries after being struck by a tree.
FY 2012,9/8/12,9/2/12,AJ's Transport LLC, Lincoln,AL,35096,,,Employee was crushed when a jack supporting a tractor trailer failed causing the trailer to fall on him.
FY 2012,6/9/12,6/1/12,Beasley Timber Co. Inc., Birmington,AL,35207,,,Worker unloading bundles of wood was killed when one of the bundles fell on him.
FY 2012,3/3/12,2/2/12,Southland Tube Inc., Birmingham,AL,35234,,,"Worker loading steel coils onto an uncoiler died after being found with his head caught between 14,000-pound coils."
FY 2012,7/14/12,7/6/12,West Alabama Mechanical, Tuscaloosa,AL,35404,,,Worker operating a crane was struck by the machine's gear box and pump when crane tipped over.
FY 2012,9/8/12,9/5/12,Tidco Transportation Inc., Double Springs,AL,35553,,,Emplyoyee died due to tractor trailer falling on him when the support jack failed.
FY 2012,3/10/12,3/3/12,Tire Centers LLC, Decatur,AL,35601,,,Worker repairing an off-road tire was killed when the multi-piece rim exploded and struck him.
FY 2012,7/28/12,7/16/12,J.C. Hamm & Sons, Florence,AL,35630,,,Worker changing a filter in an attic died of a possible electrocution.
FY 2012,12/17/11,12/8/11,The Davey Tree Expert Company, Pratville,AL,36067,,,Worker was trimming around power lines when he was struck and killed by a falling limb.
FY 2012,2/4/12,1/25/12,Delta Properties LLC, Tallassa,AL,36078,,,Worker demolishing a single story structure was killed when the structure collapsed.
FY 2012,6/2/12,5/16/12,C & M Tree Experts, Dothan,AL,36301,,,Worker performing tree trimming operations died after falling 60 feet.
FY 2012,4/21/12,4/16/12,Precision Erection Company, Fort Rucker,AL,36362,,,Worker performing new construction was struck and killed by a collapsing steel structure.
FY 2012,9/22/12,9/26/12,Advanced Recycling Center, Brewton,AL,36426,,,Worker was crushed when bucket of skid loader fell on him when he crawled under machine to disconnect a hydraulic line.
FY 2012,9/29/12,9/26/12,Advanced Recycling Center, Brewton,AL,36426,,,Worker was crushed when bucket of skid loader fell on him when he crawled under machine to disconnect a hydraulic line.
FY 2012,12/3/11,11/30/11,Inoxum, Calvert,AL,36513,,,Worker operating an overhead crane connected to a roll of steel was crushed between falling and stationary rolls of steel placed in the layout area.
FY 2012,3/10/12,3/6/12,National Steel City LLC, Calvert,AL,36513,,,Worker installing duct work in building under construction died after falling 60 feet.
FY 2012,2/4/12,12/29/11,CSA Equipment Company LLC, Mobile,AL,36601,,,"Worker performing inventory of steel coils was killed after being pinned between a 21,000 pound steel roll and a forklift's counterweight."
FY 2012,3/31/12,3/24/12,Fire Brick Engineers Company Inc., Marlon,AL,36756,,,Worker replacing the lining of a furnace was crushed between the cleaning equipment and wall. Equipment had not been locked out.
FY 2012,3/17/12,2/27/12,Gulf Equipment Corporation, Auburn,AL,36849,,,Worker performing duties inside a highway construction zone was struck and killed by a passenger vehicle.
FY 2012,4/21/12,4/9/12,Doyon Drilling Inc., Prudhoe Bay,AL,99734,,,Worker performing rig operations offshore died after he was caught between a pipe elevator support and a generator room wall.
FY 2012,1/21/12,1/12/12,Pittman Nursery Inc., Magnolia,AR,71753,,,Worker drowns after falling out of a boat while performing maintenance on an irrigation pump.
FY 2012,3/31/12,3/30/12,Frit Industries Inc., Walnut Ridge,AR,72476,,,Worker inspecting the removal of compacted soil from inside a fertilizer mixer died when he became engulfed in raw material after the mixer was turned on.
FY 2012,7/7/12,6/25/12,Symmetry Turf Installations LLC, Fayetteville,AR,72701,,,Worker laying artificial turf died from possible heat stress.
FY 2012,3/31/12,3/28/12,Utilicon Solutions LTD, Wabbaseka,AR,72775,,,Worker replacing utility poles was electrocuted.
FY 2012,2/25/12,2/17/12,US Airways Group Inc., Phoenix,AZ,85034,,,Worker was crushed between two vertically moving conveyor belts.
FY 2012,12/31/11,12/22/11,Stone Burg Marble and Granite, Tempe,AZ,85284,,,Worker was crushed by a stack of stone slabs.
FY 2012,10/1/11,8/22/11,20/20 Real Estate Review, Sahuarita,AZ,85629,,,Worker fell off a ladder.
FY 2012,12/10/11,11/1/11,Medley Communications, Sierrra Vista,AZ,85635,,,Worker died when he fell 18 feet while climbing a ladder.
FY 2012,2/18/12,2/10/12,Fertizona San-Tan, Stanfield,AZ,85712,,,Worker died from a head injury after falling off a ladder.
FY 2012,11/12/11,10/25/11,G &S Paving, Palo Alto,CA,,,,Worker struck by truck travelling in reverse.
FY 2012,6/23/12,6/13/12,NOSWerks, Los Angeles,CA,90007,,,Worker was killed when bottles of nitrous oxide exploded.
FY 2012,11/12/11,10/28/11,Dependable Highway Express Inc., Los Angeles,CA,90023,,,Worker died after falling off dock while trying to stop an out of control forklift.
FY 2012,12/10/11,12/8/11,CAL Strip Industries, Commerce,CA,90040,,,Worker died after falling nearly 40 feet from an aerial lift work platform after a bridge crane collided into the lift boom.
FY 2012,9/1/12,8/30/12,Hai Chang Inc., Bell,CA,90201,,,Worker was behind truck and was caught-between truck and loading dock.
FY 2012,5/12/12,5/10/12,Roya and Isaac Musighi, Beverly Hills,CA,90210,,,Worker inside an unshored trench at a residential construction site was asphyxiated when the trench collapsed.
FY 2012,8/4/12,8/2/12,Fox Transportation, Racho Dominiquez,CA,90220,,,Worker suffered fatal head injuries after he was runover by a transport truck.
FY 2012,7/28/12,7/22/12,All American Asphalt, Torrance,CA,90502,,,"Two workers were killed, one injured after they were struck by two vehicles while laying concrete on a highway."
FY 2012,7/28/12,7/27/12,PG&E Subcontractors, Bridgeville,CA,90526,,,Worker fell approximately 80 feet from structure.
FY 2012,1/14/12,1/4/12,Super Center Concepts, Santa Fe Springs,CA,90670,,,Worker died when he was caught between a truck and a loading dock.
FY 2012,3/31/12,3/29/12,Hathaway Ranch and Oil Museum, Santa Fe Springs,CA,90670,,,"Worker at a ranch museum who was driving a tractor died after it overturned, pinning the worker to the ground."
FY 2012,8/4/12,8/1/12,Golden State Elevators Inc., Paramount,CA,90723,,,Worker performing repairs to an elevator fell 26 feet.
FY 2012,7/28/12,7/27/12,Carlton Forge Works,Paramount,CA,90723,,,Worker performing forging activities was struck and killed by debris.
FY 2012,6/9/12,6/5/12,Abhe & Svoboda, San Pedro,CA,90731,,,Worker sand blasting diesel fuel tanks died from a possible heart attack.
FY 2012,4/21/12,4/19/12,OFC Transport, Wilmington,CA,90744,,,Worker refueling his truck was killed when the truck moved forward and rolled over him.
FY 2012,1/7/12,11/16/11,Ventura Transfer, Carson,CA,90810,,,Worker died after being struck by a trailer.
FY 2012,7/28/12,7/28/12,Esteban Casimiro, Arcadia,CA,91006,,,Worker trimming trees was electrocuted after touching a powerline.
FY 2012,11/12/11,10/7/11,Agustin Valladares Tree Trimming, Thousand Oaks,CA,91361,,,Tree trimmer died from head injuries after falling 30 feet from a tree.
FY 2012,6/9/12,6/6/12,Live Nation, Universal City,CA,91608,,,Worker fell 60 feet from scaffolding while working inside an amphitheater.
FY 2012,3/24/12,3/23/12,Harrington Plastics, Chino,CA,91710,,,Worker delivering loads of fiberglass was killed when a 420-pound load struck him on the head and landed on his chest.
FY 2012,4/21/12,4/9/12,Yorba River Inc. dba Pro-Towing, Chino,CA,91710,,,Worker performing maintenance on a tow truck was killed when he was hit and dragged by the moving truck.
FY 2012,3/24/12,3/16/12,Oscar's Painting, Rancho Cucamonga,CA,91730,,,Three workers painting inside a facility were found dead from carbon monoxide poisoning after a gasoline-powered air compressor was running without fuel.
FY 2012,2/11/12,2/8/12,Gerdan/Tamco Steel, Rancho Cucamonga,CA,91739,,,Worker was found unresponsive on the floor.
FY 2012,5/19/12,5/18/12,ABM Facility Services Inc., Ontario,CA,91767,,,Building maintenance worker changing a device used to stabilize the current in an electrical circuit was electrocuted.
FY 2012,2/11/12,1/30/12,Southern California Soil & Testing, San Diego,CA,92120,,,Worker was struck and killed by an airplane propeller while trying to start engine.
FY 2012,1/7/12,12/6/11,Summit Equipment Rental, San Diego,CA,92154,,,Worker operating a boom lift died from head injuries when lift tipped over.
FY 2012,5/5/12,5/1/12,USF Reddaway dba Reddaway, Fontana,CA,92237,,,Worker at a truck terminal died after being hit by a tractor used to move containers.
FY 2012,5/26/12,5/22/12,Boss 4 Packing LLC, Heber,CA,92249,,,Worker died from possible heat stress after becoming unconscious while harvesting cantaloupes outdoors.
FY 2012,7/28/12,7/22/12,Dalton Trucking Inc., Fontana,CA,92335,,,Worker repairing bottom of dump sand truck was caught between the truck's pneumatic and hydraulic bottom gates.
FY 2012,4/21/12,4/19/12,Erosion Control Applications Inc., Hinkley,CA,92347,,,Worker using a bobcat and boom lift to remove an aluminum tube that was stuck inside a liner roll died from head injuries when he became pinned between bobcat and its frame.
FY 2012,9/8/12,8/31/12,Fireworks and Stage FX America Inc., Lake Elsinor,CA,92530,,,Worker was preparing aerial fireworks when an explosion occurred. Worker was hospitalized but succumbed to injuries on 9/2/2012.
FY 2012,12/10/11,12/5/11,Sharp Roofing, Irvine,CA,92603,,,Worker removing roofing tiles died after falling 14 feet and striking his head.
FY 2012,2/4/12,10/16/07,American Nostalgia, Irvine,CA,92618,,,Worker who suffered seizures resulting from head and spinal injuries after a 2007 fall died from the seizures.
FY 2012,2/4/12,2/2/12,California Yacht Services, Huntington Beach,CA,92649,,,Worker drowned while cleaning a boat at the harbor.
FY 2012,11/19/11,11/15/11,Vista Paints, Fullerton,CA,92831,,,One worker was killed and another hospitalized after being overcome by fumes while using a paint stripping chemical in a confined space.
FY 2012,4/21/12,4/2/12,Santa Barbara Historical Museum, Santa Barbara,CA,93101,,,Worker suffered fatal head injuries after falling down 20 steps.
FY 2012,6/23/12,6/19/12,Sky Brand Services, Arvin,CA,93203,,,Worker dismantling pipes on an oil tanker was killed when the tank exploded.
FY 2012,1/14/12,12/30/11,Sunny Gem LLC/Cal Ag Resource, Buttom Willow,CA,93206,,,Worker was struck and killed by another worker driving a loader.
FY 2012,4/21/12,4/20/12,Key Energy Services Inc., Fellows,CA,93224,,,Worker was struck and killed while trying to stop his truck from rolling downhill.
FY 2012,12/3/11,11/30/11,Nichols Farms, Hanford,CA,93230,,,Worker was struck and killed by the seal from an over-pressurized diesel fuel tank.
FY 2012,6/9/12,6/1/12,Temp Handbody Farm Labor Services, Huron,CA,93234,,,Farm worker pruning fruit trees died from possible heat stress.
FY 2012,3/17/12,2/29/12,B&B Well Drilling, Laton,CA,93242,,,Worker at an oil rig was killed when a 300-pound clamp that he tried to attach to a well drilling machine fell on him.
FY 2012,6/23/12,6/19/12,Cleveland Wrecking Company, Bakersfield,CA,93308,,,Worker died from a 50-foot fall when the beam he was cutting collapsed and knocked over the man-basket he was inside.
FY 2012,4/7/12,4/3/12,Mericle Mechanical Inc., Mettler,CA,93313,,,Worker repairing a HVAC unit on a warehouse roof died after falling 39 feet through a skylight.
FY 2012,1/21/12,1/4/12,California Department of Corrections, San Luis Obispo,CA,93405,,,Worker was on a training hike when he collapsed.
FY 2012,10/1/11,9/23/11,Witten Logging Co., Tehachapi,CA,93561,,,Logger cutting trees was struck and killed by a large falling limb.
FY 2012,10/1/11,9/30/11,F & T Farms, Caruthers,CA,93609,,,Worker operating a farm vehicle was killed when he hit a gate and a metal pipe struck his head.
FY 2012,7/28/12,7/23/12,Terra Nova Ranch, Helm,CA,93627,,,Farm worker died from head injuries when his ATV hit a tomato trailer.
FY 2012,2/11/12,2/5/12,Bar 20 Dairy LLC, Karman,CA,93630,,,Worker washing concrete floor died after falling 12 feet over guard railing.
FY 2012,10/1/11,7/26/11,Calvin Crest Conference, Oakhurst,CA,93636,,,Rock climbing instructor died after falling from a 26-foot tower.
FY 2012,9/15/12,9/11/12,Gibson Winery, Sanger,CA,93657,,,Employee working as a wine blender died from asphyxiation after being exposed to ammonia gas.
FY 2012,10/1/11,9/28/11,Performance Welding & Machine, Fresno,CA,93725,,,Worker was electrocuted while using a welder that was not grounded properly.
FY 2012,8/1/12,8/1/12,Valley Healthcare Center LLC, Fresno,CA,93727,,,Healthcare worker died after contracting tuberculosis.
FY 2012,9/29/12,9/26/12,Steven Barkoff ,Hillsborough,CA,94010,,,"Worker fell from attic to garage floor striking a flower base, hitting the right artery by armpit resulting in loss of blood. Worker was hospitalized but died in ER."
FY 2012,4/28/12,4/28/12,Northern California Institute for Research and Education, San Francisco,CA,94121,,,Lab worker died from complications related to exposure to infectious bacteria.
FY 2012,9/29/12,9/22/12,Prime Flight Aviation Services ,San Francisco,CA,94128,,,Worker drove service truck off road crashing into parked lear jet.
FY 2012,12/24/11,12/6/11,Four Leaf Construction, Palo Alto,CA,94301,,,Worker fell in an elevator shaft.
FY 2012,3/24/12,3/9/12,Peninsula Sanitary Service Inc., Stanford,CA,94305,,,Worker on trash collection route was struck by unattended trash truck after exiting the truck to stop a dumpster from rolling down the street.
